,0,1,2,3,4,5,6
0,Sen to Chihiro no kamikakushi,(2001),G,125 min,"Animation, Adventure, Family",8.6,"
During her family's move to the suburbs, a sullen 10-year-old girl wanders into a world ruled by gods, witches and spirits, a world where humans are changed into beasts."
1,It's a Wonderful Life,(1946),7+,130 min,"Drama, Family, Fantasy",8.6,"
An angel is sent from Heaven to help a desperately frustrated businessman by showing him what life would have been like if he had never existed."
2,The Lion King,(1994),G,88 min,"Animation, Adventure, Drama",8.5,"
Lion prince Simba and his father are targeted by his bitter uncle, who wants to ascend the throne himself."
3,Spider-Man: Into the Spider-Verse,(2018),7+,117 min,"Animation, Action, Adventure",8.4,"
Teen Miles Morales becomes the Spider-Man of his universe, and must join with five spider-powered individuals from other dimensions to stop a threat for all realities."
4,Coco,(I) (2017),7+,105 min,"Animation, Adventure, Comedy",8.4,"
Aspiring musician Miguel, confronted with his family's ancestral ban on music, enters the Land of the Dead to find his great-great-grandfather, a legendary singer."
5,WALL·E,(2008),G,98 min,"Animation, Adventure, Family",8.4,"
In the distant future, a small waste-collecting robot inadvertently embarks on a space journey that will ultimately decide the fate of mankind."
6,Toy Story,(1995),G,81 min,"Animation, Adventure, Comedy",8.3,"
A cowboy doll is profoundly threatened and jealous when a new spaceman action figure supplants him as top toy in a boy's bedroom."
7,Up,(2009),G,96 min,"Animation, Adventure, Comedy",8.3,"
78-year-old Carl Fredricksen travels to Paradise Falls in his house equipped with balloons, inadvertently taking a young stowaway."
8,Toy Story 3,(2010),G,103 min,"Animation, Adventure, Comedy",8.3,"
The toys are mistakenly delivered to a day-care center instead of the attic right before Andy leaves for college, and it's up to Woody to convince the other toys that they weren't abandoned and to return home."
9,Taare Zameen Par,(2007),13+,165 min,"Drama, Family",8.3,"
An eight-year-old boy is thought to be a lazy trouble-maker, until the new art teacher has the patience and compassion to discover the real problem behind his struggles in school."
10,The Kid,(1921),7+,68 min,"Comedy, Drama, Family",8.3,"
The Tramp cares for an abandoned child, but events put their relationship in jeopardy."
11,Hauru no ugoku shiro,(2004),7+,119 min,"Animation, Adventure, Family",8.2,"
When an unconfident young woman is cursed with an old body by a spiteful witch, her only chance of breaking the spell lies with a self-indulgent yet insecure young wizard and his companions in his legged, walking castle."
12,Finding Nemo,(2003),7A,100 min,"Animation, Adventure, Comedy",8.2,"
After his son is captured in the Great Barrier Reef and taken to Sydney, a timid clownfish sets out on a journey to bring him home."
13,Klaus,(2019),7+,96 min,"Animation, Adventure, Comedy",8.2,"
A simple act of kindness always sparks another, even in a frozen, faraway place. When Smeerensburg's new postman, Jesper, befriends toymaker Klaus, their gifts melt an age-old feud and deliver a sleigh full of holiday traditions."
14,Bacheha-Ye aseman,(1997),PG,89 min,"Drama, Family, Sport",8.2,"
After a boy loses his sister's pair of shoes, he goes on a series of adventures in order to find them. When he can't, he tries a new way to ""win"" a new pair."
15,Babam ve Oglum,(2005),G,108 min,"Drama, Family",8.2,"
The family of a left-wing journalist is torn apart after the military coup of Turkey in 1980."
16,Harry Potter and the Deathly Hallows: Part 2,(2011),16+,130 min,"Adventure, Family, Fantasy",8.1,"
Harry, Ron, and Hermione search for Voldemort's remaining Horcruxes in their effort to destroy the Dark Lord as the final battle rages on at Hogwarts."
17,Ratatouille,(2007),G,111 min,"Animation, Adventure, Comedy",8.1,"
A rat who can cook makes an unusual alliance with a young kitchen worker at a famous Paris restaurant."
18,How to Train Your Dragon,(2010),7+,98 min,"Animation, Action, Adventure",8.1,"
A hapless young Viking who aspires to hunt dragons becomes the unlikely friend of a young dragon himself, and learns there may be more to the creatures than he assumed."
19,The Wizard of Oz,(1939),PG,102 min,"Adventure, Family, Fantasy",8.1,"
Young Dorothy Gale and her dog Toto are swept away by a tornado from their Kansas farm to the magical Land of Oz, and embark on a quest with three new friends to see the Wizard, who can return her to her home and fulfill the others' wishes."
20,Inside Out,(I) (2015),G,95 min,"Animation, Adventure, Comedy",8.1,"
After young Riley is uprooted from her Midwest life and moved to San Francisco, her emotions - Joy, Fear, Anger, Disgust and Sadness - conflict on how best to navigate a new city, house, and school."
21,The Sound of Music,(1965),18+,172 min,"Biography, Drama, Family",8.1,"
A young novice is sent by her convent in 1930s Austria to become a governess to the seven children of a widowed naval officer."
22,"Monsters, Inc.",(2001),7+,92 min,"Animation, Adventure, Comedy",8.1,"
In order to power the city, monsters have to scare children so that they scream. However, the children are toxic to the monsters, and after a child gets through, two monsters realize things may not be what they think."
23,Tonari no Totoro,(1988),G,86 min,"Animation, Comedy, Family",8.1,"
When two girls move to the country to be near their ailing mother, they have adventures with the wondrous forest spirits who live nearby."
24,Hachi: A Dog's Tale,(2009),---,93 min,"Biography, Drama, Family",8.1,"
A college professor bonds with an abandoned dog he takes into his home."
25,The Iron Giant,(1999),G,86 min,"Animation, Action, Adventure",8.1,"
A young boy befriends a giant robot from outer space that a paranoid government agent wants to destroy."
26,Ôkami kodomo no Ame to Yuki,(2012),PG,117 min,"Animation, Drama, Family",8.1,"
After her werewolf lover unexpectedly dies in an accident while hunting for food for their children, a young woman must find ways to raise the werewolf son and daughter that she had with him while keeping their trait hidden from society."
27,Chak De! India,(2007),---,153 min,"Drama, Family, Sport",8.1,"
Kabir Khan, the coach of the Indian Women's National Hockey Team, dreams of making his all-girls team emerge victorious against all odds."
28,The Circus,(1928),---,72 min,"Comedy, Family, Romance",8.1,"
The Tramp finds work and the girl of his dreams at a circus."
29,The Princess Bride,(1987),---,98 min,"Adventure, Comedy, Family",8.0,"
A bedridden boy's grandfather reads him the story of a farmboy-turned-pirate who encounters numerous obstacles, enemies and allies in his quest to be reunited with his true love."
30,Zootopia,(2016),7A,108 min,"Animation, Adventure, Comedy",8.0,"
In a city of anthropomorphic animals, a rookie bunny cop and a cynical con artist fox must work together to uncover a conspiracy."
31,The Incredibles,(2004),G,115 min,"Animation, Action, Adventure",8.0,"
While trying to lead a quiet suburban life, a family of undercover superheroes are forced into action to save the world."
32,Aladdin,(1992),G,90 min,"Animation, Adventure, Comedy",8.0,"
A kind-hearted street urchin and a power-hungry Grand Vizier vie for a magic lamp that has the power to make their deepest wishes come true."
33,Beauty and the Beast,(1991),G,84 min,"Animation, Family, Fantasy",8.0,"
A prince cursed to spend his days as a hideous monster sets out to regain his humanity by earning a young woman's love."
34,Soul,(2020),7+,100 min,"Animation, Adventure, Comedy",8.0,"
After landing the gig of a lifetime, a New York jazz pianist suddenly finds himself trapped in a strange land between Earth and the afterlife."
35,Fiddler on the Roof,(1971),---,181 min,"Drama, Family, Musical",8.0,"
In pre-revolutionary Russia, a Jewish peasant with traditional values contends with marrying off three of his daughters with modern romantic ideals while growing anti-Semitic sentiment threatens his village."
36,Tenkû no shiro Rapyuta,(1986),---,125 min,"Animation, Adventure, Family",8.0,"
A young boy and a girl with a magic crystal must race against pirates and foreign agents in a search for a legendary floating castle."
37,WolfWalkers,(2020),PG,103 min,"Animation, Action, Adventure",8.0,"
A young apprentice hunter and her father journey to Ireland to help wipe out the last wolf pack. But everything changes when she befriends a free-spirited girl from a mysterious tribe rumored to transform into wolves by night."
38,Song of the Sea,(2014),PG,93 min,"Animation, Adventure, Drama",8.0,"
Ben, a young Irish boy, and his little sister Saoirse, a girl who can turn into a seal, go on an adventure to free the fairies and save the spirit world."
39,Kaguya-hime no monogatari,(2013),PG,137 min,"Animation, Drama, Family",8.0,"
Found inside a shining stalk of bamboo by an old bamboo cutter and his wife, a tiny girl grows rapidly into an exquisite young lady. The mysterious young princess enthralls all who encounter her, but ultimately she must confront her fate, the punishment for her crime."
40,Puss in Boots: The Last Wish,(2022),6+,102 min,"Animation, Adventure, Comedy",7.9,"
When Puss in Boots discovers that his passion for adventure has taken its toll and he has burned through eight of his nine lives, he launches an epic journey to restore them by finding the mythical Last Wish."
41,Harry Potter and the Prisoner of Azkaban,(2004),13+,142 min,"Adventure, Family, Fantasy",7.9,"
Harry Potter, Ron and Hermione return to Hogwarts School of Witchcraft and Wizardry for their third year of study, where they delve into the mystery surrounding an escaped prisoner who poses a dangerous threat to the young wizard."
42,Shrek,(2001),7+,90 min,"Animation, Adventure, Comedy",7.9,"
A mean lord exiles fairytale creatures to the swamp of a grumpy ogre, who must go on a quest and rescue a princess for the lord in order to get his land back."
43,The Ten Commandments,(1956),---,220 min,"Adventure, Drama, Family",7.9,"
Moses, raised as a prince of Egypt in the Pharaoh's household, learns of his true heritage as a Hebrew and his divine mission as the deliverer of his people from slavery."
44,Fantastic Mr. Fox,(2009),7+,87 min,"Animation, Adventure, Comedy",7.9,"
An urbane fox cannot resist returning to his farm raiding ways and then must help his community survive the farmers' retaliation."
45,Wonder,(I) (2017),7A,113 min,"Drama, Family",7.9,"
Based on the New York Times bestseller, this movie tells the incredibly inspiring and heartwarming story of August Pullman, a boy with facial differences who enters the fifth grade, attending a mainstream elementary school for the first time."
46,E.T. the Extra-Terrestrial,(1982),G,115 min,"Adventure, Family, Sci-Fi",7.9,"
A troubled child summons the courage to help a friendly alien escape from Earth and return to his home planet."
47,Toy Story 2,(1999),G,92 min,"Animation, Adventure, Comedy",7.9,"
When Woody is stolen by a toy collector, Buzz and his friends set out on a rescue mission to save Woody before he becomes a museum toy property with his roundup gang Jessie, Prospector, and Bullseye."
48,The Nightmare Before Christmas,(1993),G,76 min,"Animation, Family, Fantasy",7.9,"
Jack Skellington, king of Halloween Town, discovers Christmas Town, but his attempts to bring Christmas to his home causes confusion."
49,Togo,(2019),PG,113 min,"Adventure, Biography, Drama",7.9,"
The story of Togo, the sled dog who led the 1925 serum run despite being considered too small and weak to lead such an intense race."
50,A Christmas Story,(1983),13A,93 min,"Comedy, Family",7.9,"
In the 1940s, a young boy named Ralphie Parker attempts to convince his parents, teacher, and Santa Claus that a Red Ryder Range 200 Shot BB gun really is the perfect Christmas gift."
51,Mimi wo sumaseba,(1995),7+,111 min,"Animation, Drama, Family",7.9,"
A love story between a girl who loves reading books, and a boy who has previously checked out all of the library books she chooses."
52,Miracle on 34th Street,(1947),---,96 min,"Comedy, Drama, Family",7.9,"
After a divorced New York mother hires a nice old man to play Santa Claus at Macy's, she is startled by his claim to be the genuine article. When his sanity is questioned, a lawyer defends him in court by arguing that he's not mistaken."
53,My Fair Lady,(1964),7+,170 min,"Drama, Family, Musical",7.8,"
In 1910s London, snobbish phonetics professor Henry Higgins agrees to a wager that he can make crude flower girl, Eliza Doolittle, presentable in high society."
54,The Sandlot,(1993),PG,101 min,"Comedy, Drama, Family",7.8,"
In the summer of 1962, a new kid in town is taken under the wing of a young baseball prodigy and his rowdy team, resulting in many adventures."
55,Willy Wonka & the Chocolate Factory,(1971),G,100 min,"Family, Fantasy, Musical",7.8,"
A poor but hopeful boy seeks one of the five coveted golden tickets that will send him on a tour of Willy Wonka's mysterious chocolate factory."
56,Moonrise Kingdom,(2012),13A,94 min,"Comedy, Drama, Family",7.8,"
A pair of young lovers flee their New England town, which causes a local search party to fan out to find them."
57,Mary Poppins,(1964),G,139 min,"Comedy, Family, Fantasy",7.8,"
In turn of the century London, a magical nanny employs music and adventure to help two neglected children become closer to their father."
58,Paddington 2,(2017),7+,103 min,"Adventure, Comedy, Family",7.8,"
Paddington, now happily settled with the Brown family and a popular member of the local community, picks up a series of odd jobs to buy the perfect present for his Aunt Lucy's 100th birthday, only for the gift to be stolen."
59,Big Hero 6,(2014),G,102 min,"Animation, Action, Adventure",7.8,"
A special bond develops between plus-sized inflatable robot Baymax and prodigy Hiro Hamada, who together team up with a group of friends to form a band of high-tech heroes."
60,How to Train Your Dragon 2,(2014),G,102 min,"Animation, Action, Adventure",7.8,"
When Hiccup and Toothless discover an ice cave that is home to hundreds of new wild dragons and the mysterious Dragon Rider, the two friends find themselves at the center of a battle to protect the peace."
61,Majo no takkyûbin,(1989),7+,103 min,"Animation, Family, Fantasy",7.8,"
A young witch, on her mandatory year of independent life, finds fitting into a new community difficult while she supports herself by running an air courier service."
62,October Sky,(1999),7+,108 min,"Biography, Drama, Family",7.8,"
The true story of Homer Hickam, a coal miner's son who was inspired by the first Sputnik launch to take up rocketry against his father's wishes."
63,Batman: Mask of the Phantasm,(1993),PG,76 min,"Animation, Action, Adventure",7.8,"
Batman is wrongly implicated in a series of murders of mob bosses actually done by a new vigilante assassin."
64,Veer-Zaara,(2004),---,192 min,"Drama, Family, Musical",7.8,"
""Veer-Zaara"" is a saga of love, separation, courage, and sacrifice. A love story that is an inspiration and will remain a legend forever."
65,English Vinglish,(2012),---,134 min,"Comedy, Drama, Family",7.8,"
A quiet, sweet tempered housewife endures small slights from her well-educated husband and daughter every day because of her inability to speak and understand English."
66,The Goonies,(1985),G,114 min,"Adventure, Comedy, Family",7.7,"
A group of young misfits called The Goonies discover an ancient map and set out on an adventure to find a legendary pirate's long-lost treasure."
67,Harry Potter and the Goblet of Fire,(2005),13+,157 min,"Adventure, Family, Fantasy",7.7,"
Harry Potter finds himself competing in a hazardous tournament between rival schools of magic, but he is distracted by recurring nightmares."
68,Home Alone,(1990),G,103 min,"Comedy, Family",7.7,"
An eight-year-old troublemaker, mistakenly left home alone, must defend his home against a pair of burglars on Christmas eve."
69,Harry Potter and the Deathly Hallows: Part 1,(2010),13+,146 min,"Adventure, Family, Fantasy",7.7,"
As Harry, Ron and Hermione race against time and evil to destroy the Horcruxes, they uncover the existence of the three most powerful objects in the wizarding world: the Deathly Hallows."
70,The Lego Movie,(2014),G,100 min,"Animation, Action, Adventure",7.7,"
An ordinary LEGO construction worker, thought to be the prophesied as ""special"", is recruited to join a quest to stop an evil tyrant from gluing the LEGO universe into eternal stasis."
71,Coraline,(2009),7+,100 min,"Animation, Drama, Family",7.7,"
An adventurous 11-year-old girl finds another world that is a strangely idealized version of her frustrating home, but it has sinister secrets."
72,Tangled,(2010),G,100 min,"Animation, Adventure, Comedy",7.7,"
The magically long-haired Rapunzel has spent her entire life in a tower, but now that a runaway thief has stumbled upon her, she is about to discover the world for the first time, and who she really is."
73,Toy Story 4,(2019),G,100 min,"Animation, Adventure, Comedy",7.7,"
When a new toy called ""Forky"" joins Woody and the gang, a road trip alongside old and new friends reveals how big the world can be for a toy."
74,Who Framed Roger Rabbit,(1988),7+,104 min,"Animation, Adventure, Comedy",7.7,"
A toon-hating detective is a cartoon rabbit's only hope to prove his innocence when he is accused of murder."
75,Wreck-It Ralph,(2012),7A,101 min,"Animation, Adventure, Comedy",7.7,"
A video game villain wants to be a hero and sets out to fulfill his dream, but his quest brings havoc to the whole arcade where he lives."
76,Finding Neverland,(2004),7A,106 min,"Biography, Drama, Family",7.7,"
The story of Sir J.M. Barrie's friendship with a family who inspired him to create Peter Pan."
77,Kubo and the Two Strings,(2016),7+,101 min,"Animation, Action, Adventure",7.7,"
A young boy named Kubo must locate a magical suit of armour worn by his late father in order to defeat a vengeful spirit from the past."
78,Fantasia,(1940),---,124 min,"Animation, Family, Fantasy",7.7,"
A collection of animated interpretations of great works of Western classical music, ranging from the abstract to depictions of mythology and fantasy, and settings including the prehistoric, supernatural and sacred."
79,Doragon bôru chô: Burorî,(2018),13A,100 min,"Animation, Action, Adventure",7.7,"
Goku and Vegeta encounter Broly, a Saiyan warrior unlike any fighter they've faced before."
80,Le Petit Prince,(2015),G,108 min,"Animation, Adventure, Drama",7.7,"
A little girl lives in a very grown-up world with her mother, who tries to prepare her for it. Her neighbor, the Aviator, introduces the girl to an extraordinary world where anything is possible, the world of the Little Prince."
81,Omoide no Marnie,(2014),PG,103 min,"Animation, Drama, Family",7.7,"
Due to 12 y.o. Anna's asthma, she's sent to stay with relatives of her guardian in the Japanese countryside. She likes to be alone, sketching. She befriends Marnie. Who is the mysterious, blonde Marnie."
82,Toki o kakeru shôjo,(2006),---,98 min,"Animation, Adventure, Comedy",7.7,"
A high-school girl named Makoto acquires the power to travel back in time, and decides to use it for her own personal benefits. Little does she know that she is affecting the lives of others just as much as she is her own."
83,How Green Was My Valley,(1941),---,118 min,"Drama, Family",7.7,"
At the turn of the century in a Welsh mining village, the Morgans, he stern, she gentle, raise coal-mining sons and hope their youngest will find a better life."
84,The Breadwinner,(2017),13+,94 min,"Animation, Drama, Family",7.7,"
In 2001, Afghanistan is under the control of the Taliban. When her father is captured, a determined young girl disguises herself as a boy in order to provide for her family."
85,The Muppet Christmas Carol,(1992),---,85 min,"Comedy, Drama, Family",7.7,"
The Muppets present their own touching rendition of Charles Dickens' classic tale."
86,Kapoor & Sons,(2016),---,132 min,"Comedy, Drama, Family",7.7,"
The story about two brothers who visit their dysfunctional family for their grandfather's birthday party."
87,Harry Potter and the Sorcerer's Stone,(2001),7+,152 min,"Adventure, Family, Fantasy",7.6,"
An orphaned boy enrolls in a school of wizardry, where he learns the truth about himself, his family and the terrible evil that haunts the magical world."
88,Moana,(I) (2016),G,107 min,"Animation, Adventure, Comedy",7.6,"
In Ancient Polynesia, when a terrible curse incurred by the Demigod Maui reaches Moana's island, she answers the Ocean's call to seek out the Demigod to set things right."
89,Guillermo del Toro's Pinocchio,(2022),7+,117 min,"Animation, Drama, Family",7.6,"
A father's wish magically brings a wooden boy to life in Italy, giving him a chance to care for the child."
90,Harry Potter and the Half-Blood Prince,(2009),16+,153 min,"Action, Adventure, Family",7.6,"
As Harry Potter begins his sixth year at Hogwarts, he discovers an old book marked as ""the property of the Half-Blood Prince"" and begins to learn more about Lord Voldemort's dark past."
91,Stardust,(2007),13+,127 min,"Adventure, Family, Fantasy",7.6,"
In a countryside town bordering on a magical land, a young man makes a promise to his beloved that he'll retrieve a fallen star by venturing into the magical realm."
92,The Little Mermaid,(1989),G,83 min,"Animation, Adventure, Family",7.6,"
A mermaid princess makes a Faustian bargain in an attempt to become human and win a prince's love."
93,Kung Fu Panda,(2008),7+,92 min,"Animation, Action, Adventure",7.6,"
To everyone's surprise, including his own, Po, an overweight, clumsy panda, is chosen as protector of the Valley of Peace. His suitability will soon be tested as the valley's arch-enemy is on his way."
94,Incredibles 2,(2018),G,118 min,"Animation, Action, Adventure",7.6,"
The Incredibles family takes on a new mission which involves a change in family roles: Bob Parr (Mr. Incredible) must manage the house while his wife Helen (Elastigirl) goes out to save the world."
95,Mulan,(1998),G,87 min,"Animation, Adventure, Comedy",7.6,"
To save her father from death in the army, a young maiden secretly goes in his place and becomes one of China's greatest heroines in the process."
96,Despicable Me,(2010),7+,95 min,"Animation, Adventure, Comedy",7.6,"
When a criminal mastermind uses a trio of orphan girls as pawns for a grand scheme, he finds their love is profoundly changing him for the better."
97,The Mitchells vs the Machines,(2021),13A,114 min,"Animation, Adventure, Comedy",7.6,"
A quirky, dysfunctional family's road trip is upended when they find themselves in the middle of the robot apocalypse and suddenly become humanity's unlikeliest last hope."
98,The Jungle Book,(1967),G,78 min,"Animation, Adventure, Comedy",7.6,"
Bagheera the Panther and Baloo the Bear have a difficult time trying to convince a boy to leave the jungle for human civilization."
99,Gake no ue no Ponyo,(2008),7+,101 min,"Animation, Adventure, Comedy",7.6,"
A five-year-old boy develops a relationship with Ponyo, a young goldfish princess who longs to become a human after falling in love with him."
100,Snow White and the Seven Dwarfs,(1937),Approved,83 min,"Animation, Adventure, Family",7.6,"
Exiled into the dangerous forest by her wicked stepmother, a princess is rescued by seven dwarf miners who make her part of their household."
101,Karigurashi no Arietty,(2010),---,94 min,"Animation, Adventure, Drama",7.6,"
The Clock family are four-inch-tall people who live anonymously in another family's residence, borrowing simple items to make their home. Life changes for the Clocks when their teenage daughter Arrietty is discovered."
102,A Little Princess,(1995),G,97 min,"Drama, Family, Fantasy",7.6,"
A young girl is relegated to servitude at a boarding school when her father goes missing and is presumed dead."
103,The Muppet Movie,(1979),---,95 min,"Adventure, Comedy, Family",7.6,"
Kermit and his newfound friends trek across America to find success in Hollywood, but a frog legs merchant is after Kermit."
104,The Secret of Kells,(2009),---,71 min,"Animation, Adventure, Family",7.6,"
A young boy in a remote medieval outpost under siege from barbarian raids is beckoned to adventure when a celebrated master illuminator arrives with an ancient book, brimming with secret wisdom and powers."
105,Harry Potter and the Order of the Phoenix,(2007),13+,138 min,"Action, Adventure, Family",7.5,"
With their warning about Lord Voldemort's return scoffed at, Harry and Dumbledore are targeted by the Wizard authorities as an authoritarian bureaucrat slowly seizes power at Hogwarts."
106,Ice Age,(2002),G,81 min,"Animation, Adventure, Comedy",7.5,"
The story revolves around sub-zero heroes: a woolly mammoth, a saber-toothed tiger, a sloth and a prehistoric combination of a squirrel and rat, known as Scrat."
107,Field of Dreams,(1989),G,107 min,"Drama, Family, Fantasy",7.5,"
Iowa farmer Ray Kinsella is inspired by a voice he can't ignore to pursue a dream he can hardly believe. Supported by his wife, Ray begins the quest by turning his ordinary cornfield into a place where dreams can come true."
108,Hugo,(2011),G,126 min,"Adventure, Drama, Family",7.5,"
In 1931 Paris, an orphan living in the walls of a train station gets wrapped up in a mystery involving his late father and an automaton."
109,Robin Hood,(1973),---,83 min,"Animation, Adventure, Comedy",7.5,"
The story of the legendary British outlaw portrayed with the characters as anthropomorphic animals."
