,0,1,2,3,4,5,6
110,Byôsoku 5 senchimêtoru,(2007),---,63 min,"Animation, Drama, Family",7.5,"
Told in three interconnected segments, we follow a young man named Takaki through his life as cruel winters, cold technology, and finally, adult obligations and responsibility converge to test the delicate petals of love."
111,Secondhand Lions,(2003),PG,111 min,"Comedy, Drama, Family",7.5,"
A coming-of-age story about a shy young boy sent by his irresponsible mother to spend the summer with his wealthy, eccentric uncles in Texas."
112,The Secret of NIMH,(1982),---,82 min,"Animation, Adventure, Drama",7.5,"
To save her ill son, a field mouse must seek the aid of a colony of rats, with whom she has a deeper link than she suspected."
113,Pinocchio,(1940),G,88 min,"Animation, Adventure, Comedy",7.5,"
A living puppet, with the help of a cricket as his conscience, must prove himself worthy to become a real boy."
114,The Curse of the Were-Rabbit,(2005),---,85 min,"Animation, Adventure, Comedy",7.5,"
Wallace and his loyal dog, Gromit, set out to discover the mystery behind the garden sabotage that plagues their village and threatens the annual giant vegetable growing contest."
115,Meet Me in St. Louis,(1944),---,113 min,"Comedy, Drama, Family",7.5,"
Young love and childish fears highlight a year in the life of a turn-of-the-century family."
116,The Many Adventures of Winnie the Pooh,(1977),---,74 min,"Animation, Adventure, Comedy",7.5,"
In this collection of animated shorts based on the stories and characters by A.A. Milne, Winnie the Pooh, a honey-loving teddy bear, embarks on some eccentric adventures."
117,Whale Rider,(2002),PG-13,101 min,"Drama, Family",7.5,"
A contemporary story of love, rejection and triumph as a young Maori girl fights to fulfill a destiny her grandfather refuses to recognize."
118,La tortue rouge,(2016),G,80 min,"Animation, Drama, Family",7.5,"
A man is shipwrecked on a deserted island and encounters a red turtle, which changes his life."
119,The Super Mario Bros. Movie,(2023),PG,92 min,"Animation, Adventure, Comedy",7.4,"
The story of The Super Mario Bros. on their journey through the Mushroom Kingdom."
120,Sing 2,(2021),G,110 min,"Animation, Adventure, Comedy",7.4,"
Buster Moon and his friends must persuade reclusive rock star Clay Calloway to join them for the opening of a new show."
121,Harry Potter and the Chamber of Secrets,(2002),13+,161 min,"Adventure, Family, Fantasy",7.4,"
An ancient prophecy seems to be coming true when a mysterious presence begins stalking the corridors of a school of magic and leaving its victims paralyzed."
122,Frozen,(I) (2013),G,102 min,"Animation, Adventure, Comedy",7.4,"
When the newly crowned Queen Elsa accidentally uses her power to turn things into ice to curse her home in infinite winter, her sister Anna teams up with a mountain man, his playful reindeer, and a snowman to change the weather condition."
123,How to Train Your Dragon: The Hidden World,(2019),7+,104 min,"Animation, Action, Adventure",7.4,"
When Hiccup discovers Toothless isn't the only Night Fury, he must seek ""The Hidden World"", a secret Dragon Utopia before a hired tyrant named Grimmel finds it first."
124,Luca,(2021),6A,95 min,"Animation, Adventure, Comedy",7.4,"
On the Italian Riviera, an unlikely but strong friendship grows between a human being and a sea monster disguised as a human."
125,The Emperor's New Groove,(2000),---,78 min,"Animation, Adventure, Comedy",7.4,"
Emperor Kuzco is turned into a llama by his ex-administrator Yzma, and must now regain his throne with the help of Pacha, the gentle llama herder."
126,The Jungle Book,(2016),13A,106 min,"Adventure, Drama, Family",7.4,"
After a threat from the tiger Shere Khan forces him to flee the jungle, a man-cub named Mowgli embarks on a journey of self discovery with the help of panther Bagheera and free-spirited bear Baloo."
127,The Land Before Time,(1988),---,69 min,"Animation, Adventure, Drama",7.4,"
An orphaned brontosaurus teams up with other young dinosaurs in order to reunite with their families in a valley."
128,Onward,(I) (2020),6+,102 min,"Animation, Adventure, Comedy",7.4,"
Two elven brothers embark on a quest to bring their father back for one day."
129,Oliver!,(1968),---,153 min,"Drama, Family, Musical",7.4,"
After being sold to a mortician, young orphan Oliver Twist runs away and meets a group of boys trained to be pickpockets by an elderly mentor in 1830s London."
130,A Monster Calls,(2016),13A,108 min,"Adventure, Drama, Family",7.4,"
A boy seeks the help of a tree monster to cope with his single mother's terminal illness."
131,Kokuriko-zaka kara,(2011),PG,91 min,"Animation, Comedy, Drama",7.4,"
A group of Yokohama teens look to save their school's clubhouse from the wrecking ball in preparations for the 1964 Tokyo Olympics."
132,A Dog's Journey,(2019),PG,109 min,"Adventure, Comedy, Drama",7.4,"
A dog finds the meaning of his own existence through the lives of the humans he meets."
133,Lilo & Stitch,(2002),13+,85 min,"Animation, Adventure, Comedy",7.3,"
A young and parentless girl adopts a 'dog' from the local pound, completely unaware that it's supposedly a dangerous scientific experiment that's taken refuge on Earth and is now hiding from its creator and those who see it as a menace."
134,Hercules,(1997),G,93 min,"Animation, Adventure, Comedy",7.3,"
The son of Zeus and Hera is stripped of his immortality as an infant and must become a true hero in order to reclaim it."
135,The NeverEnding Story,(1984),---,102 min,"Adventure, Drama, Family",7.3,"
A troubled boy dives into a wondrous fantasy world through the pages of a mysterious book."
136,Shrek 2,(2004),7+,93 min,"Animation, Adventure, Comedy",7.3,"
Shrek and Fiona travel to the Kingdom of Far Far Away, where Fiona's parents are King and Queen, to celebrate their marriage. When they arrive, they find they are not as welcome as they thought they would be."
137,Labyrinth,(1986),13+,101 min,"Adventure, Family, Fantasy",7.3,"
Sixteen-year-old Sarah is given thirteen hours to solve a labyrinth and rescue her baby brother Toby when her wish for him to be taken away is granted by the Goblin King Jareth."
138,The Karate Kid,(1984),13+,126 min,"Action, Drama, Family",7.3,"
A martial arts master agrees to teach karate to a bullied teenager."
139,Raya and the Last Dragon,(2021),7A,107 min,"Animation, Action, Adventure",7.3,"
In a realm known as Kumandra, a re-imagined Earth inhabited by an ancient civilization, a warrior named Raya is determined to find the last dragon."
140,The Lego Batman Movie,(2017),13A,104 min,"Animation, Action, Adventure",7.3,"
A cooler-than-ever Bruce Wayne must deal with the usual suspects as they plan to rule Gotham City, while discovering that he has accidentally adopted a teenage orphan who wishes to become his sidekick."
141,Tarzan,(1999),G,88 min,"Animation, Adventure, Comedy",7.3,"
A man raised by gorillas must decide where he really belongs when he discovers he is a human."
142,Megamind,(2010),7+,95 min,"Animation, Action, Comedy",7.3,"
Evil genius Megamind finally defeats his do-gooder nemesis, Metro Man, but is left without a purpose in a superhero-free world."
143,Paddington,(2014),G,95 min,"Adventure, Comedy, Family",7.3,"
A young Peruvian bear travels to London in search of a home. Finding himself lost and alone at Paddington Station, he meets the kindly Brown family, who offer him a temporary haven."
144,Peter Pan,(1953),G,77 min,"Animation, Adventure, Family",7.3,"
Wendy and her brothers are whisked away to the magical world of Neverland with the hero of their stories, Peter Pan."
145,Finding Dory,(2016),G,97 min,"Animation, Adventure, Comedy",7.3,"
Friendly but forgetful blue tang Dory begins a search for her long-lost parents and everyone learns a few things about the real meaning of family along the way."
146,The Adventures of Tintin,(2011),7+,107 min,"Animation, Action, Adventure",7.3,"
Intrepid reporter Tintin and Captain Haddock set off on a treasure hunt for a sunken ship commanded by Haddock's ancestor."
147,My Sister's Keeper,(2009),G,109 min,"Drama, Family",7.3,"
Anna Fitzgerald looks to earn medical emancipation from her parents who until now have relied on their youngest child to help their leukemia-stricken daughter Kate remain alive."
148,Despicable Me 2,(2013),G,98 min,"Animation, Adventure, Comedy",7.3,"
When Gru, the world's most super-bad turned super-dad has been recruited by a team of officials to stop lethal muscle and a host of Gru's own, He has to fight back with new gadgetry, cars, and more minion madness."
149,The Secret Garden,(1993),---,101 min,"Drama, Family, Fantasy",7.3,"
A young, recently-orphaned girl is sent to England after living in India all of her life. Once there, she begins to explore her new, seemingly-isolated surroundings, and its secrets."
150,Alice in Wonderland,(1951),---,75 min,"Animation, Adventure, Comedy",7.3,"
Alice stumbles into the world of Wonderland. Will she get home? Not if the Queen of Hearts has her way."
151,Corpse Bride,(2005),7+,77 min,"Animation, Drama, Family",7.3,"
When a shy groom practices his wedding vows in the inadvertent presence of a deceased young woman, she rises from the grave assuming he has married her."
152,Little Women,(1994),13A,115 min,"Drama, Family, Romance",7.3,"
The March sisters live and grow in post-Civil War America."
153,Cinderella,(1950),G,74 min,"Animation, Family, Fantasy",7.3,"
When Cinderella's cruel stepmother prevents her from attending the Royal Ball, she gets some unexpected help from the lovable mice Gus and Jaq and from her Fairy Godmother."
154,One Hundred and One Dalmatians,(1961),---,79 min,"Animation, Adventure, Comedy",7.3,"
When a litter of Dalmatian puppies are abducted by the minions of Cruella De Vil, the owners must find them before she uses them for a diabolical fashion statement."
155,Lady and the Tramp,(1955),G,76 min,"Animation, Adventure, Comedy",7.3,"
The romantic tale of a sheltered uptown Cocker Spaniel dog and a streetwise downtown Mutt."
156,Jason and the Argonauts,(1963),---,104 min,"Action, Adventure, Family",7.3,"
The legendary Greek hero leads a team of intrepid adventurers in a perilous quest for the legendary Golden Fleece."
157,Bambi,(1942),G,69 min,"Animation, Adventure, Drama",7.3,"
The story of a young deer growing up in the forest."
158,The Last Unicorn,(1982),---,92 min,"Animation, Adventure, Drama",7.3,"
A beautiful unicorn sets out to learn if she truly is the last of her kind in this sparkling animated musical."
159,The Brave Little Toaster,(1987),---,90 min,"Animation, Adventure, Family",7.3,"
A group of dated appliances embark on a journey to the city to find their master after being abandoned in a cabin in the woods."
160,Eight Below,(2006),PG,120 min,"Adventure, Drama, Family",7.3,"
Brutal cold forces two Antarctic explorers to leave their team of sled dogs behind as they fend for their survival."
161,A Street Cat Named Bob,(2016),---,103 min,"Biography, Drama, Family",7.3,"
The true feel-good story of how James Bowen, a busker and recovering drug addict, has his life transformed when he meets a stray ginger cat. Based on the international best selling book."
162,Heisei tanuki gassen ponpoko,(1994),PG,119 min,"Animation, Comedy, Drama",7.3,"
A community of magical shape-shifting raccoon dogs struggle to prevent their forest home from being destroyed by urban development."
163,Shaun the Sheep Movie,(2015),PG,85 min,"Animation, Adventure, Comedy",7.3,"
When Shaun decides to take the day off and have some fun, he gets a little more action than he bargained for. A mix up with the Farmer, a caravan and a very steep hill lead them all to the Big City and it's up to Shaun and the flock to return everyone safely to the green grass of home."
164,Encanto,(2021),G,102 min,"Animation, Comedy, Family",7.2,"
A Colombian teenage girl has to face the frustration of being the only member of her family without magical powers."
165,DC League of Super-Pets,(2022),6+,105 min,"Animation, Action, Adventure",7.2,"
Krypto the Super-Dog and Superman are inseparable best friends, sharing the same superpowers and fighting crime side by side in Metropolis. However, Krypto must master his own powers for a rescue mission when Superman is kidnapped."
166,Cars,(2006),G,117 min,"Animation, Adventure, Comedy",7.2,"
On the way to the biggest race of his life, a hotshot rookie race car gets stranded in a rundown town, and learns that winning isn't everything in life."
167,Bridge to Terabithia,(2007),7+,96 min,"Drama, Family, Fantasy",7.2,"
A preteen's life turns upside down when he befriends the new girl in school and they imagine a whole new fantasy world to escape reality."
168,A Bug's Life,(1998),G,95 min,"Animation, Adventure, Comedy",7.2,"
A misfit ant, looking for ""warriors"" to save his colony from greedy grasshoppers, recruits a group of bugs that turn out to be an inept circus troupe."
169,The Prince of Egypt,(1998),PG,99 min,"Animation, Adventure, Drama",7.2,"
Egyptian Prince Moses learns of his identity as a Hebrew and his destiny to become the chosen deliverer of his people."
170,Fantastic Beasts and Where to Find Them,(2016),13A,132 min,"Adventure, Family, Fantasy",7.2,"
The adventures of writer Newt Scamander in New York's secret community of witches and wizards seventy years before Harry Potter reads his book in school."
171,Rango,(2011),7A,107 min,"Animation, Action, Adventure",7.2,"
Rango is an ordinary chameleon who accidentally winds up in the town of Dirt, a lawless outpost in the Wild West in desperate need of a new sheriff."
172,Treasure Planet,(2002),PG,95 min,"Animation, Adventure, Family",7.2,"
In this science fiction rendering of the classic novel ""Treasure Island"", Jim Hawkins (Joseph Gordon-Levitt) is a rebellious teen seen by the world as an aimless slacker. After he receives ...                See full summary »
"
173,Monsters University,(2013),G,104 min,"Animation, Adventure, Comedy",7.2,"
A look at the relationship between Mike Wazowski (Billy Crystal) and James P. ""Sully"" Sullivan (John Goodman) during their days at Monsters University, when they weren't necessarily the best of friends."
174,The Croods,(2013),G,98 min,"Animation, Action, Adventure",7.2,"
After their cave is destroyed, a caveman family must trek through an unfamiliar fantastical world with the help of an inventive boy."
175,Kung Fu Panda 2,(2011),7+,90 min,"Animation, Action, Adventure",7.2,"
Po and his friends fight to stop a peacock villain from conquering China with a deadly new weapon, but first the Dragon Warrior must come to terms with his past."
176,Sleeping Beauty,(1959),G,75 min,"Animation, Adventure, Family",7.2,"
After being snubbed by the royal family, a malevolent fairy places a curse on a princess which only a prince can break, along with the help of three good fairies."
177,Spirit: Stallion of the Cimarron,(2002),G,83 min,"Animation, Adventure, Drama",7.2,"
A wild stallion is captured by humans and slowly loses the will to resist training, yet, throughout his struggles for freedom, the stallion refuses to let go of the hope of one day returning home to his herd."
178,The Fox and the Hound,(1981),---,83 min,"Animation, Adventure, Drama",7.2,"
A fox named Tod and a hound named Copper vow to be best friends forever. But as Copper grows into a hunting dog, their unlikely friendship faces the ultimate test."
179,The Book of Life,(2014),PG,95 min,"Animation, Adventure, Comedy",7.2,"
Manolo, a young man who is torn between fulfilling the expectations of his family and following his heart, embarks on an adventure that spans three fantastic worlds where he must face his greatest fears."
180,Wish Dragon,(2021),G,98 min,"Animation, Adventure, Comedy",7.2,"
Determined teen Din is longing to reconnect with his childhood best friend when he meets a wish-granting dragon who shows him the magic of possibilities."
181,Christopher Robin,(2018),G,104 min,"Adventure, Comedy, Drama",7.2,"
A working-class family man, Christopher Robin, encounters his childhood friend Winnie-the-Pooh, who helps him to rediscover the joys of life."
182,Rise of the Guardians,(2012),7A,97 min,"Animation, Action, Adventure",7.2,"
When the evil spirit Pitch launches an assault on Earth, the Immortal Guardians team up to protect the innocence of children all around the world."
183,A Dog's Purpose,(2017),PG,100 min,"Adventure, Comedy, Drama",7.2,"
A dog looks to discover his purpose in life over the course of several lifetimes and owners."
184,"20,000 Leagues Under the Sea",(1954),---,127 min,"Adventure, Drama, Family",7.2,"
A ship sent to investigate a wave of mysterious sinkings encounters the advanced submarine, the Nautilus, commanded by Captain Nemo."
185,Secretariat,(2010),G,123 min,"Biography, Drama, Family",7.2,"
Penny Chenery Tweedy and colleagues guide her long-shot but precocious stallion to set, in 1973, the unbeaten record for winning the Triple Crown."
186,Dumbo,(1941),G,64 min,"Animation, Adventure, Drama",7.2,"
Ridiculed because of his enormous ears, a young circus elephant is assisted by a mouse to achieve his full potential."
187,The Transformers: The Movie,(1986),---,84 min,"Animation, Action, Adventure",7.2,"
The Autobots must stop a colossal planet consuming robot who goes after the Autobot Matrix of Leadership. At the same time, they must defend themselves against an all-out attack from the Decepticons."
188,Stan & Ollie,(2018),G,98 min,"Biography, Comedy, Drama",7.2,"
Laurel and Hardy, the world's most famous comedy duo, attempt to reignite their film careers as they embark on what becomes their swan song: a grueling theatre tour of post-war Britain."
189,Beauty and the Beast,(I) (2017),13A,129 min,"Adventure, Family, Fantasy",7.1,"
A selfish Prince is cursed to become a monster for the rest of his life, unless he learns to fall in love with a beautiful young woman he keeps prisoner."
190,Sing,(2016),G,108 min,"Animation, Comedy, Family",7.1,"
In a city of humanoid animals, a hustling theater impresario's attempt to save his theater with a singing competition becomes grander than he anticipates even as its finalists find that their lives will never be the same."
191,The Princess and the Frog,(2009),---,97 min,"Animation, Adventure, Comedy",7.1,"
A waitress, desperate to fulfill her dreams as a restaurant owner, is set on a journey to turn a frog prince back into a human being, but she has to face the same problem after she kisses him."
192,Enchanted,(2007),G,107 min,"Animation, Adventure, Comedy",7.1,"
A young maiden in a land called Andalasia, who is prepared to be wed, is sent away to New York City by an evil Queen, where she falls in love with a lawyer."
193,Brave,(2012),G,93 min,"Animation, Adventure, Comedy",7.1,"
Determined to make her own path in life, Princess Merida defies a custom that brings chaos to her kingdom. Granted one wish, Merida must rely on her bravery and her archery skills to undo a beastly curse."
194,Anastasia,(1997),---,94 min,"Animation, Adventure, Drama",7.1,"
The last surviving child of the Russian Royal Family joins two con men to reunite with her grandmother, the Dowager Empress, while the undead Rasputin seeks her death."
195,The AristoCats,(1970),---,78 min,"Animation, Adventure, Comedy",7.1,"
With the help of a smooth talking tomcat, a family of Parisian felines set to inherit a fortune from their owner try to make it back home after a jealous butler kidnaps them and leaves them in the country."
196,Kung Fu Panda 3,(2016),7+,95 min,"Animation, Action, Adventure",7.1,"
Continuing his ""legendary adventures of awesomeness"", Po must face two hugely epic, but different threats: one supernatural and the other a little closer to home."
197,Chicken Run,(2000),---,84 min,"Animation, Adventure, Comedy",7.1,"
When a cockerel apparently flies into a chicken farm, the chickens see him as an opportunity to escape their evil owners."
198,Elf,(2003),7+,97 min,"Adventure, Comedy, Family",7.1,"
Raised as an oversized elf, Buddy travels from the North Pole to New York City to meet his biological father, Walter Hobbs, who doesn't know he exists and is in desperate need of some Christmas spirit."
199,We Bought a Zoo,(2011),PG,124 min,"Comedy, Drama, Family",7.1,"
Set in Southern California, a father moves his young family to the countryside to renovate and re-open a struggling zoo."
200,The SpongeBob SquarePants Movie,(2004),G,87 min,"Animation, Adventure, Comedy",7.1,"
SpongeBob SquarePants takes leave from the town of Bikini Bottom in order to track down King Neptune's stolen crown."
201,Miracles from Heaven,(2016),PG,109 min,"Biography, Drama, Family",7.1,"
Based on the incredible true story of the Beam family."
202,The Dark Crystal,(1982),G,93 min,"Adventure, Family, Fantasy",7.1,"
On another planet in the distant past, a Gelfling embarks on a quest to find the missing shard of a magical crystal, and to restore order to his world."
203,The Muppets,(2011),PG,120 min,"Adventure, Comedy, Family",7.1,"
A Muppet fanatic with some help from his 2 human compatriots must regroup the Muppet gang to stop an avaricious oil mogul from taking down one of their precious life-longing treasures."
204,The Sword in the Stone,(1963),---,79 min,"Animation, Adventure, Comedy",7.1,"
A poor boy named Arthur learns the power of love, kindness, knowledge and bravery with the help of a wizard called Merlin in the path to become one of the most beloved kings in English history."
205,Winnie the Pooh,(2011),---,63 min,"Animation, Adventure, Comedy",7.1,"
While searching for honey, Pooh and his friends embark on an adventure to find Eeyore's missing tail and rescue Christopher Robin from an unknown monster called The Backson."
206,Neko no ongaeshi,(2002),G,75 min,"Animation, Adventure, Comedy",7.1,"
After helping a cat, a seventeen-year-old girl finds herself involuntarily engaged to a cat Prince in a magical world where her only hope of freedom lies with a dapper cat statuette come to life."
207,The Great Mouse Detective,(1986),G,74 min,"Animation, Adventure, Family",7.1,"
Basil, the rodent Sherlock Holmes, investigates the kidnapping of a toy maker and uncovers its link to his archenemy, Professor Ratigan."
208,Balto,(1995),---,78 min,"Animation, Adventure, Drama",7.1,"
An outcast Husky risks his life with other sled dogs to prevent a deadly epidemic from ravaging Nome, Alaska."
209,Goodbye Christopher Robin,(2017),PG,107 min,"Biography, Drama, Family",7.1,"
The relationship between writer AA Milne and his son, Christopher Robin, and how this became the inspiration for Winnie the Pooh."
210,Fantasia 2000,(1999),---,75 min,"Animation, Family, Fantasy",7.1,"
An update of the original film with new interpretations of great works of classical music."
211,Dragon Ball Z: Doragon bôru Z - Kami to Kami,(2013),---,85 min,"Animation, Action, Adventure",7.1,"
The Z-Fighters must contend with Lord Beerus, the God of Destruction, but only a God can fight a God, and none of them are Gods. However with the creation of the Super Saiyan God, will the Z-Fighters be able to defeat Lord Beerus?"
212,Arthur Christmas,(2011),7+,97 min,"Animation, Adventure, Comedy",7.1,"
Santa's clumsy son Arthur sets out on a mission with Grandsanta to give out a present they misplaced to a young girl in less than two hours."
213,Matilda,(1996),G,98 min,"Comedy, Family, Fantasy",7.0,"
A girl gifted with a keen intellect and psychic powers uses both to deal with her crude, distant family and free her kind teacher from their sadistic headmistress."
214,Holes,(2003),PG,117 min,"Adventure, Comedy, Drama",7.0,"
A wrongfully convicted boy is sent to a brutal desert detention camp where he joins the job of digging holes for some mysterious reason."
215,Jumanji,(1995),13+,104 min,"Adventure, Comedy, Family",7.0,"
When two kids find and play a magical board game, they release a man trapped in it for decades - and a host of dangers that can only be stopped by finishing the game."
216,Hotel Transylvania,(2012),G,91 min,"Animation, Adventure, Comedy",7.0,"
Dracula, who operates a high-end resort away from the human world, goes into overprotective mode when a boy discovers the resort and falls for the count's teenaged daughter."
217,Turning Red,(2022),6+,100 min,"Animation, Adventure, Comedy",7.0,"
A 13-year-old girl named Meilin turns into a giant red panda whenever she gets too excited."
218,The Sea Beast,(2022),7+,115 min,"Animation, Adventure, Comedy",7.0,"
When a young girl stows away on the ship of a legendary sea monster hunter, they launch an epic journey into uncharted waters - and make history to boot."
219,The Hunchback of Notre Dame,(1996),---,91 min,"Animation, Drama, Family",7.0,"
A deformed bell-ringer must assert his independence from a vicious government minister in order to help his friend, a gypsy dancer."
220,Ralph Breaks the Internet,(2018),7+,112 min,"Animation, Adventure, Comedy",7.0,"
Six years after the events of ""Wreck-It Ralph,"" Ralph and Vanellope, now friends, discover a wi-fi router in their arcade, leading them into a new adventure."
221,Chip 'n Dale: Rescue Rangers,(2022),PG,97 min,"Animation, Action, Adventure",7.0,"
Thirty years after their popular television show ended, chipmunks Chip and Dale live very different lives. When a cast member from the original series mysteriously disappears, the pair must reunite to save their friend."
222,Bedknobs and Broomsticks,(1971),---,117 min,"Animation, Adventure, Comedy",7.0,"
An apprentice witch, three kids and a cynical magician conman search for the missing component to a magic spell to be used in the defense of Britain in World War II."
223,Pee-wee's Big Adventure,(1985),---,91 min,"Adventure, Comedy, Family",7.0,"
When eccentric man-child Pee-wee Herman gets his beloved bike stolen in broad daylight, he sets out across the U.S. on the adventure of his life."
