,0,1,2,3,4,5,6
224,Cool Runnings,(1993),PG,98 min,"Adventure, Comedy, Family",7.0,"
When a Jamaican sprinter is disqualified from the Olympic Games, he enlists the help of a dishonored coach to start the first Jamaican Bobsled Team."
225,Marley & Me,(2008),G,111 min,"Drama, Family",7.0,"
A family learns important life lessons from their adorable, but naughty and neurotic dog."
226,Soul Surfer,(2011),PG,112 min,"Biography, Drama, Family",7.0,"
Teenage surfer Bethany Hamilton overcomes the odds and her own fears of returning to the water after losing her left arm in a shark attack."
227,Ron's Gone Wrong,(2021),6A,107 min,"Animation, Adventure, Comedy",7.0,"
The story of Barney, an awkward middle-schooler and Ron, his new walking, talking, digitally-connected device. Ron's malfunctions set against the backdrop of the social media age launch them on a journey to learn about true friendship."
228,Abominable,(2019),7A,97 min,"Animation, Adventure, Comedy",7.0,"
Three teenagers must help a Yeti return to his family while avoiding a wealthy man and a zoologist who want him for their own needs."
229,ParaNorman,(2012),13A,92 min,"Animation, Adventure, Comedy",7.0,"
A misunderstood boy takes on ghosts, zombies and grown-ups to save his town from a centuries-old curse."
230,An Unfinished Life,(2005),PG-13,108 min,"Drama, Family, Romance",7.0,"
Desperate to provide care for her daughter, down-on-her-luck Jean moves in with her father in-law from whom she is estranged. Through time, they learn to forgive each other and heal old wounds."
231,The Peanuts Movie,(2015),G,88 min,"Animation, Adventure, Comedy",7.0,"
Snoopy embarks upon his greatest mission as he and his team take to the skies to pursue their archnemesis, while his best pal Charlie Brown begins his own epic quest back home to win the love of his life."
232,Son of Rambow,(2007),PG-13,96 min,"Action, Adventure, Comedy",7.0,"
During a long English summer in the early 1980s, two schoolboys from differing backgrounds set out to make a film inspired by First Blood (1982)."
233,The Christmas Chronicles,(2018),7+,104 min,"Adventure, Comedy, Family",7.0,"
The story of sister and brother, Kate and Teddy Pierce, whose Christmas Eve plan to catch Santa Claus on camera turns into an unexpected journey that most kids could only dream about."
234,"The Chronicles of Narnia: The Lion, the Witch and the Wardrobe",(2005),G,143 min,"Adventure, Family, Fantasy",6.9,"
Four kids travel through a wardrobe to the land of Narnia and learn of their destiny to free it with the guidance of a mystical lion."
235,Aladdin,(2019),7A,128 min,"Adventure, Comedy, Family",6.9,"
A kind-hearted street urchin and a power-hungry Grand Vizier vie for a magic lamp that has the power to make their deepest wishes come true."
236,Rio,(2011),G,96 min,"Animation, Adventure, Comedy",6.9,"
When Blu, a domesticated macaw from small-town Minnesota, meets the fiercely independent Jewel, he takes off on an adventure to Rio de Janeiro with the bird of his dreams."
237,Cinderella,(I) (2015),G,105 min,"Adventure, Drama, Family",6.9,"
When her father unexpectedly dies, young Ella finds herself at the mercy of her cruel stepmother and her scheming stepsisters. Never one to give up hope, Ella's fortunes begin to change after meeting a dashing stranger."
238,Madagascar,(2005),G,86 min,"Animation, Adventure, Comedy",6.9,"
A group of animals who have spent all their life in a New York zoo end up in the jungles of Madagascar, and must adjust to living in the wild."
239,Atlantis: The Lost Empire,(2001),PG,95 min,"Animation, Action, Adventure",6.9,"
A young linguist named Milo Thatch joins an intrepid group of explorers to find the mysterious lost continent of Atlantis."
240,Maleficent,(2014),7A,97 min,"Adventure, Family, Fantasy",6.9,"
A vengeful fairy is driven to curse an infant princess, only to discover that the child may be the one person who can restore peace to their troubled land."
241,Flight of the Navigator,(1986),---,90 min,"Adventure, Comedy, Family",6.9,"
In 1978, a boy travels eight years into the future and has an adventure with an intelligent, wisecracking alien ship."
242,My Girl,(1991),18+,102 min,"Comedy, Drama, Family",6.9,"
A young girl on the threshold of her teen years finds her life turning upside down when she is accompanied by an unlikely friend."
243,Homeward Bound: The Incredible Journey,(1993),---,84 min,"Adventure, Comedy, Drama",6.9,"
A fun-loving American bulldog pup, a hilarious Himalayan cat, and a wise old golden retriever embark on a long trek through the rugged wilderness of the Sierra Nevada mountains in a quest to reach home and their beloved owners."
244,Chitty Chitty Bang Bang,(1968),---,144 min,"Adventure, Family, Fantasy",6.9,"
A down-on-his-luck inventor turns a broken-down Grand Prix car into a fancy vehicle for his children, and then they go off on a magical fantasy adventure to save their grandfather in a far-off land."
245,Hocus Pocus,(1993),PG,96 min,"Comedy, Family, Fantasy",6.9,"
A teenage boy named Max and his little sister move to Salem, where he struggles to fit in before awakening a trio of diabolical witches that were executed in the 17th century."
246,A Goofy Movie,(1995),G,78 min,"Animation, Adventure, Comedy",6.9,"
When Max makes a preposterous promise to a girl he has a crush on, his chances to fulfilling it seem hopeless when he is dragged onto a cross-country trip with his embarrassing father, Goofy."
247,Cloudy with a Chance of Meatballs,(2009),G,90 min,"Animation, Adventure, Comedy",6.9,"
A local scientist is often regarded as a failure until he invents a machine that can make food fall from the sky. But little does he know that things are about to take a turn for the worst."
248,Clash of the Titans,(1981),PG,118 min,"Action, Adventure, Family",6.9,"
Perseus must battle Medusa and the Kraken to save the Princess Andromeda."
249,The Road to El Dorado,(2000),G,89 min,"Animation, Adventure, Comedy",6.9,"
Two swindlers get their hands on a map to the fabled city of gold, El Dorado."
250,The Croods: A New Age,(2020),6+,95 min,"Animation, Adventure, Comedy",6.9,"
The prehistoric family the Croods are challenged by a rival family the Bettermans, who claim to be better and more evolved."
251,Babe,(1995),G,91 min,"Comedy, Drama, Family",6.9,"
Babe, a pig raised by sheepdogs on a rural English farm, learns to herd sheep with a little help from Farmer Hoggett."
252,The Rookie,(2002),---,127 min,"Drama, Family, Sport",6.9,"
A Texas baseball coach makes the major league after agreeing to try out if his high school team made the playoffs."
253,Ice Age: Dawn of the Dinosaurs,(2009),G,94 min,"Animation, Adventure, Comedy",6.9,"
When Sid's attempt to adopt three dinosaur eggs gets him abducted by their real mother to an underground lost world, his friends attempt to rescue him."
254,The Rescuers,(1977),---,77 min,"Animation, Adventure, Comedy",6.9,"
Two mice of the Rescue Aid Society search for a little girl kidnapped by unscrupulous treasure hunters."
255,An American Tail,(1986),---,80 min,"Animation, Adventure, Comedy",6.9,"
While emigrating to the United States, a young Russian mouse gets separated from his family and must relocate them while trying to survive in a new country."
256,Legend of the Guardians: The Owls of Ga'Hoole,(2010),PG,97 min,"Animation, Action, Adventure",6.9,"
When a young owl is abducted by an evil Owl army, he must escape with new-found friends and seek the legendary Guardians to stop the menace."
257,Fly Away Home,(1996),PG,107 min,"Adventure, Drama, Family",6.9,"
A father and daughter decide to attempt to lead a flock of orphaned Canada Geese south by air."
258,Frankenweenie,(2012),13A,87 min,"Animation, Comedy, Drama",6.9,"
When a boy's beloved dog passes away suddenly, he attempts to bring the animal back to life through a powerful science experiment."
259,Muppet Treasure Island,(1996),---,99 min,"Action, Adventure, Comedy",6.9,"
The Muppets' twist on the classic tale."
260,Hook,(1991),G,142 min,"Adventure, Comedy, Family",6.8,"
When Captain James Hook kidnaps his children, an adult Peter Pan must return to Neverland and reclaim his youthful spirit in order to challenge his old enemy."
261,Peter Pan,(2003),PG,113 min,"Adventure, Family, Fantasy",6.8,"
The Darling family children receive a visit from Peter Pan, who takes them to Never Never Land where an ongoing war with the evil Pirate Captain Hook is taking place."
262,The Lion King,(2019),13A,118 min,"Animation, Adventure, Drama",6.8,"
After the murder of his father, a young lion prince flees his kingdom only to learn the true meaning of responsibility and bravery."
263,The Bad Guys,(2022),6A,100 min,"Animation, Adventure, Comedy",6.8,"
To avoid prison, a gang of notorious animal criminals pretends to seek being rehabilitated, only for their leader to realize that he genuinely wants to change his ways."
264,Frozen II,(2019),10A,103 min,"Animation, Adventure, Comedy",6.8,"
Anna, Elsa, Kristoff, Olaf and Sven leave Arendelle to travel to an ancient, autumn-bound forest of an enchanted land. They set out to find the origin of Elsa's powers in order to save their kingdom."
265,A Series of Unfortunate Events,(2004),7A,108 min,"Adventure, Comedy, Family",6.8,"
When a massive fire kills their parents, three children are delivered to the custody of cousin and stage actor Count Olaf, who is secretly plotting to steal their parents' vast fortune."
266,Home Alone 2: Lost in New York,(1992),G,120 min,"Adventure, Comedy, Crime",6.8,"
One year after Kevin McCallister was left home alone and had to defeat a pair of bumbling burglars, he accidentally finds himself stranded in New York City - and the same criminals are not far behind."
267,Meet the Robinsons,(2007),G,95 min,"Animation, Adventure, Comedy",6.8,"
Lewis is a brilliant inventor who meets mysterious stranger named Wilbur Robinson, whisking Lewis away in a time machine and together they team up to track down Bowler Hat Guy in a showdown that ends with an unexpected twist of fate."
268,Bolt,(2008),G,96 min,"Animation, Adventure, Comedy",6.8,"
The canine star of a fictional sci-fi/action show that believes his powers are real embarks on a cross country trek to save his co-star from a threat he believes is just as real."
269,Mr. Peabody & Sherman,(2014),PG,92 min,"Animation, Adventure, Comedy",6.8,"
The time-travelling adventures of an advanced canine and his adopted son, as they endeavor to fix a time rift they created."
270,The Witches,(1990),7A,91 min,"Adventure, Comedy, Family",6.8,"
A young boy stumbles onto a witch convention and must stop them, even after he has been turned into a mouse."
271,Brother Bear,(2003),---,85 min,"Animation, Adventure, Comedy",6.8,"
When a young Inuit hunter needlessly kills a bear, he is magically changed into a bear himself as punishment with a talkative cub being his only guide to changing back."
272,Horton Hears a Who!,(2008),---,86 min,"Animation, Adventure, Comedy",6.8,"
Horton the Elephant struggles to protect a microscopic community from his neighbors who refuse to believe it exists."
273,Madagascar 3: Europe's Most Wanted,(2012),G,95 min,"Animation, Adventure, Comedy",6.8,"
The Madagascar animals join a struggling European circus to get back to New York, but find themselves being pursued by a psychotic animal-control officer."
274,Storks,(2016),G,87 min,"Animation, Adventure, Comedy",6.8,"
Storks have moved on from delivering babies to packages. But when an order for a baby appears, the best delivery stork must scramble to fix the error by delivering the baby."
275,Spies in Disguise,(2019),10A,102 min,"Animation, Action, Adventure",6.8,"
When the world's best spy is turned into a pigeon, he must rely on his nerdy tech officer to save the world."
276,The Rescuers Down Under,(1990),---,77 min,"Animation, Adventure, Comedy",6.8,"
R.A.S. agents Miss Bianca and Bernard race to Australia to save a little boy and a rare golden eagle from a murderous poacher."
277,Ice Age: The Meltdown,(2006),G,91 min,"Animation, Adventure, Comedy",6.8,"
Manny, Sid and Diego discover that the ice age is coming to an end, and join everybody for a journey to higher ground. On the trip, they discover that Manny is not in fact the last of the woolly mammoths."
278,A Christmas Carol,(2009),7A,96 min,"Animation, Adventure, Comedy",6.8,"
An animated retelling of Charles Dickens' classic novel about a Victorian-era miser taken on a journey of self-redemption, courtesy of several mysterious Christmas apparitions."
279,The Boxtrolls,(2014),7+,96 min,"Animation, Adventure, Comedy",6.8,"
A young orphaned boy raised by underground cave-dwelling trash collectors tries to save his friends from an evil exterminator."
280,DuckTales the Movie: Treasure of the Lost Lamp,(1990),---,74 min,"Animation, Adventure, Comedy",6.8,"
Scrooge McDuck takes Huey, Dewey, and Louie to Egypt to find a pyramid and magic lamp."
281,Millions,(2004),PG,98 min,"Comedy, Crime, Drama",6.8,"
Ethics, being human and the soul come to the fore when a 7-year old finds a bag of Pounds just days before the currency is switched to Euros and learns what we are really made of."
282,Over the Hedge,(2006),PG,83 min,"Animation, Adventure, Comedy",6.7,"
A scheming raccoon fools a mismatched family of forest creatures into helping him repay a debt of food, by invading the new suburban sprawl that popped up while they were hibernating...and learns a lesson about family himself."
283,Charlie and the Chocolate Factory,(2005),7+,115 min,"Adventure, Comedy, Family",6.7,"
A young boy wins a tour through the most magnificent chocolate factory in the world, led by the world's most unusual candy maker."
284,Miss Peregrine's Home for Peculiar Children,(2016),13A,127 min,"Adventure, Drama, Family",6.7,"
When Jacob (Asa Butterfield) discovers clues to a mystery that stretches across time, he finds Miss Peregrine's Home for Peculiar Children. But the danger deepens after he gets to know the residents and learns about their special powers."
285,Teenage Mutant Ninja Turtles,(1990),---,93 min,"Action, Adventure, Comedy",6.7,"
Four teenage mutant ninja turtles emerge from the shadows to protect New York City from a gang of criminal ninjas."
286,The Good Dinosaur,(2015),7A,93 min,"Animation, Adventure, Comedy",6.7,"
In a world where dinosaurs and humans live side-by-side, an Apatosaurus named Arlo makes an unlikely human friend."
287,Slumberland,(2022),7+,117 min,"Adventure, Comedy, Drama",6.7,"
A young girl discovers a secret map to the dreamworld of Slumberland, and with the help of an eccentric outlaw, she traverses dreams and flees nightmares, with the hope that she will be able to see her late father again."
288,The Call of the Wild,(2020),10A,100 min,"Adventure, Drama, Family",6.7,"
A sled dog struggles for survival in the wilds of the Yukon."
289,Cars 3,(2017),7+,102 min,"Animation, Adventure, Comedy",6.7,"
Lightning McQueen sets out to prove to a new generation of racers that he's still the best race car in the world."
290,Pocahontas,(I) (1995),G,81 min,"Animation, Adventure, Drama",6.7,"
An English soldier and the daughter of an Algonquin chief share a romance when English colonists invade seventeenth century Virginia."
291,Mary Poppins Returns,(2018),7+,130 min,"Adventure, Comedy, Family",6.7,"
A few decades after her original visit, Mary Poppins, the magical nanny, returns to help the Banks siblings and Michael's children through a difficult time in their lives."
292,Ferdinand,(2017),7+,108 min,"Animation, Adventure, Comedy",6.7,"
After Ferdinand, a bull with a big heart, is mistaken for a dangerous beast, he is captured and torn from his home. Determined to return to his family, he rallies a misfit team on the ultimate adventure."
293,Return to Oz,(1985),G,113 min,"Adventure, Family, Fantasy",6.7,"
Dorothy, saved from a psychiatric experiment by a mysterious girl, is somehow called back to Oz when a vain witch and the Nome King destroy everything that makes the magical land beautiful."
294,All Dogs Go to Heaven,(1989),---,84 min,"Animation, Adventure, Comedy",6.7,"
A canine angel, Charlie, sneaks back to earth from heaven but ends up befriending an orphan girl who can speak to animals. In the process, Charlie learns that friendship is the most heavenly gift of all."
295,James and the Giant Peach,(1996),PG,79 min,"Animation, Adventure, Family",6.7,"
An orphan who lives with his two cruel aunts befriends anthropomorphic bugs who live inside a giant peach, and they embark on a journey to New York City."
296,Pete's Dragon,(2016),7+,102 min,"Action, Adventure, Comedy",6.7,"
The adventures of an orphaned boy named Pete and his best friend Elliott, who happens to be a dragon."
297,Surf's Up,(2007),PG,85 min,"Animation, Adventure, Comedy",6.7,"
A behind-the-scenes look at the annual Penguin World Surfing Championship, and its newest participant, up-and-comer Cody Maverick."
298,Where the Wild Things Are,(2009),PG,101 min,"Adventure, Drama, Family",6.7,"
Yearning for escape and adventure, a young boy runs away from home and sails to an island filled with creatures that take him in as their king."
299,Sinbad: Legend of the Seven Seas,(2003),PG,88 min,"Animation, Adventure, Comedy",6.7,"
The sailor of legend is framed by the goddess Eris for the theft of the Book of Peace and must travel to her realm at the end of the world to retrieve it and save the life of his childhood friend Prince Proteus."
