,0,1,2,3,4,5,6
0,Forrest Gump,(1994),7+,142 min,"Drama, Romance",8.8,"
The presidencies of Kennedy and Johnson, the Vietnam War, the Watergate scandal and other historical events unfold from the perspective of an Alabama man with an IQ of 75, whose only desire is to be reunited with his childhood sweetheart."
1,La vita è bella,(1997),13+,116 min,"Comedy, Drama, Romance",8.6,"
When an open-minded Jewish waiter and his son become victims of the Holocaust, he uses a perfect mixture of will, humor and imagination to protect his son from the dangers around their camp."
2,It's a Wonderful Life,(1946),7+,130 min,"Drama, Family, Fantasy",8.6,"
An angel is sent from Heaven to help a desperately frustrated businessman by showing him what life would have been like if he had never existed."
3,Sita Ramam,(2022),G,163 min,"Action, Drama, Mystery",8.6,"
An orphan soldier, Lieutenant Ram's life changes, after he gets a letter from a girl named Sita. He meets her and love blossoms between them. When he comes back to his camp in Kashmir,After he gets caught in jail, he sends a letter to Sita which won't reach her."
4,Casablanca,(1942),G,102 min,"Drama, Romance, War",8.5,"
A cynical expatriate American cafe owner struggles to decide whether or not to help his former lover and her fugitive husband escape the Nazis in French Morocco."
5,Nuovo Cinema Paradiso,(1988),15+,155 min,"Drama, Romance",8.5,"
A filmmaker recalls his childhood when falling in love with the pictures at the cinema of his home village and forms a deep friendship with the cinema's projectionist."
6,Modern Times,(1936),---,87 min,"Comedy, Drama, Romance",8.5,"
The Tramp struggles to live in modern industrial society with the help of a young homeless woman."
7,City Lights,(1931),G,87 min,"Comedy, Drama, Romance",8.5,"
With the aid of a wealthy erratic tippler, a dewy-eyed tramp who has fallen in love with a sightless flower girl accumulates money to be able to help her medically."
8,96,(II) (2018),---,158 min,"Drama, Romance",8.5,"
Two high school sweethearts meet at a reunion after 22 years and reminisce about their past."
9,Kimi no na wa.,(2016),7+,106 min,"Animation, Drama, Fantasy",8.4,"
Two strangers find themselves linked in a bizarre way. When a connection forms, will distance be the only thing to keep them apart?"
10,Dil Bechara,(2020),---,101 min,"Comedy, Drama, Romance",8.4,"
The emotional journey of two hopelessly-in-love youngsters; a young girl, Kizie, who is suffering from cancer; and Manny, a boy Kizie meets at a support group."
11,Good Will Hunting,(1997),7+,126 min,"Drama, Romance",8.3,"
Will Hunting, a janitor at M.I.T., has a gift for mathematics, but needs help from a psychologist to find direction in his life."
12,Eternal Sunshine of the Spotless Mind,(2004),16+,108 min,"Drama, Romance, Sci-Fi",8.3,"
When their relationship turns sour, a couple undergoes a medical procedure to have each other erased from their memories for ever."
13,Le fabuleux destin d'Amélie Poulain,(2001),13+,122 min,"Comedy, Romance",8.3,"
Amélie is an innocent and naive girl in Paris with her own sense of justice. She decides to help those around her and, along the way, discovers love."
14,Vertigo,(1958),18+,128 min,"Mystery, Romance, Thriller",8.3,"
A former San Francisco police detective juggles wrestling with his personal demons and becoming obsessed with the hauntingly beautiful woman he has been hired to trail, who may be deeply disturbed."
15,Singin' in the Rain,(1952),G,103 min,"Comedy, Musical, Romance",8.3,"
A silent film star falls for a chorus girl just as he and his delusionally jealous screen partner are trying to make the difficult transition to talking pictures in 1920s Hollywood."
16,The Apartment,(1960),---,125 min,"Comedy, Drama, Romance",8.3,"
A Manhattan insurance clerk tries to rise in his company by letting its executives use his apartment for trysts, but complications and a romance of his own ensue."
17,Chhichhore,(2019),---,143 min,"Comedy, Drama, Romance",8.3,"
A tragic incident forces Anirudh, a middle-aged man, to take a trip down memory lane and reminisce his college days along with his friends, who were labelled as losers."
18,Gone with the Wind,(1939),G,238 min,"Drama, Romance, War",8.2,"
American motion picture classic in which a manipulative woman and a roguish man conduct a turbulent romance during the Civil War and Reconstruction periods."
19,Some Like It Hot,(1959),---,121 min,"Comedy, Music, Romance",8.2,"
After two male musicians witness a mob hit, they flee the state in an all-female band disguised as women, but further complications set in."
20,El secreto de sus ojos,(2009),R,129 min,"Drama, Mystery, Romance",8.2,"
A retired legal counselor writes a novel hoping to find closure for one of his past unresolved homicide cases and for his unreciprocated love with his superior - both of which still haunt him decades later."
21,Zindagi Na Milegi Dobara,(2011),---,155 min,"Comedy, Drama, Musical",8.2,"
Three friends decide to turn their fantasy vacation into reality after one of their friends gets engaged."
22,To Be or Not to Be,(1942),---,99 min,"Comedy, Romance, War",8.2,"
During the Nazi occupation of Poland, an acting troupe becomes embroiled in a Polish soldier's efforts to track down a German spy."
23,Sherlock Jr.,(1924),---,45 min,"Action, Comedy, Romance",8.2,"
A film projectionist longs to be a detective, and puts his meagre skills to work when he is framed by a rival for stealing his girlfriend's father's pocketwatch."
24,Ah-ga-ssi,(2016),18+,145 min,"Drama, Romance, Thriller",8.1,"
A woman is hired as a handmaiden to a Japanese heiress, but secretly she is involved in a plot to defraud her."
25,The Sound of Music,(1965),18+,172 min,"Biography, Drama, Family",8.1,"
A young novice is sent by her convent in 1930s Austria to become a governess to the seven children of a widowed naval officer."
26,Before Sunrise,(1995),13+,101 min,"Drama, Romance",8.1,"
A young man and woman meet on a train in Europe, and wind up spending one evening together in Vienna. Unfortunately, both know that this will probably be their only night together."
27,Portrait de la jeune fille en feu,(2019),15+,122 min,"Drama, Romance",8.1,"
On an isolated island in Brittany at the end of the eighteenth century, a female painter is obliged to paint a wedding portrait of a young woman."
28,Fa yeung nin wah,(2000),DİKKAT,98 min,"Drama, Romance",8.1,"
Two neighbors form a strong bond after both suspect extramarital activities of their spouses. However, they agree to keep their bond platonic so as not to commit similar wrongs."
29,Before Sunset,(2004),15+,80 min,"Drama, Romance",8.1,"
Nine years after Jesse and Celine first met, they encounter each other again on the French leg of Jesse's book tour."
30,Rebecca,(1940),---,130 min,"Drama, Film-Noir, Mystery",8.1,"
A self-conscious woman juggles adjusting to her new role as an aristocrat's wife and avoiding being intimidated by his first wife's spectral presence."
31,The Best Years of Our Lives,(1946),---,170 min,"Drama, Romance, War",8.1,"
Three World War II veterans, two of them traumatized or disabled, return home to the American midwest to discover that they and their families have been irreparably changed."
32,Trois couleurs: Rouge,(1994),15+,99 min,"Drama, Mystery, Romance",8.1,"
A model discovers a retired judge is keen on invading people's privacy."
33,It Happened One Night,(1934),---,105 min,"Comedy, Romance",8.1,"
A renegade reporter trailing a young runaway heiress for a big story joins her on a bus heading from Florida to New York, and they end up stuck with each other when the bus leaves them behind at one of the stops."
34,Yi yi,(2000),---,173 min,"Drama, Romance",8.1,"
Each member of a middle-class Taipei family seeks to reconcile past and present relationships within their daily lives."
35,Sunrise: A Song of Two Humans,(1927),---,94 min,"Drama, Romance",8.1,"
A sophisticated city woman seduces a farmer and convinces him to murder his wife and join her in the city, but he ends up rekindling his romance with his wife when he changes his mind at the last moment."
36,Smultronstället,(1957),---,91 min,"Drama, Romance",8.1,"
After living a life marked by coldness, an aging professor is forced to confront the emptiness of his existence."
37,A Woman Under the Influence,(1974),---,155 min,"Drama, Romance",8.1,"
Although wife and mother Mabel is loved by her husband Nick, her mental illness places a strain on the marriage."
38,Ba wang bie ji,(1993),R,171 min,"Drama, Music, Romance",8.1,"
Two boys meet at an opera training school in Peking in 1924. Their resulting friendship will span nearly 70 years and will endure some of the most troublesome times in China's history."
39,The Red Shoes,(1948),---,135 min,"Drama, Music, Romance",8.1,"
A young ballet dancer is torn between the man she loves and her pursuit to become a prima ballerina."
40,The Gold Rush,(1925),---,95 min,"Adventure, Comedy, Drama",8.1,"
A prospector goes to the Klondike during the 1890s gold rush in hopes of making his fortune, and is smitten with a girl he sees in a dance hall."
41,Dil Chahta Hai,(2001),G,183 min,"Comedy, Drama, Romance",8.1,"
Three inseparable childhood friends are just out of college. Nothing comes between them - until they each fall in love, and their wildly different approaches to relationships creates tension."
42,Da hong denglong gaogao gua,(1991),---,125 min,"Drama, Romance",8.1,"
A young woman becomes the fourth wife of a wealthy lord, and must learn to live with the strict rules and tensions within the household."
43,Barfi!,(2012),13+,151 min,"Comedy, Drama, Romance",8.1,"
Three young people learn that love can neither be defined nor contained by society's definition of normal and abnormal."
44,The Circus,(1928),---,72 min,"Comedy, Family, Romance",8.1,"
The Tramp finds work and the girl of his dreams at a circus."
45,The Princess Bride,(1987),---,98 min,"Adventure, Comedy, Family",8.0,"
A bedridden boy's grandfather reads him the story of a farmboy-turned-pirate who encounters numerous obstacles, enemies and allies in his quest to be reunited with his true love."
46,Her,(2013),15+,126 min,"Drama, Romance, Sci-Fi",8.0,"
In a near future, a lonely writer develops an unlikely relationship with an operating system designed to meet his every need."
47,La La Land,(2016),G,128 min,"Comedy, Drama, Music",8.0,"
While navigating their careers in Los Angeles, a pianist and an actress fall in love while attempting to reconcile their aspirations for the future."
48,The Graduate,(1967),15+,106 min,"Comedy, Drama, Romance",8.0,"
A disillusioned college graduate finds himself torn between his older lover and her daughter."
49,Aladdin,(1992),G,90 min,"Animation, Adventure, Comedy",8.0,"
A kind-hearted street urchin and a power-hungry Grand Vizier vie for a magic lamp that has the power to make their deepest wishes come true."
50,Groundhog Day,(1993),7+,101 min,"Comedy, Drama, Fantasy",8.0,"
A narcissistic, self-centered weatherman finds himself in a time loop on Groundhog Day, and the day keeps repeating until he gets it right."
51,The Maltese Falcon,(1941),---,100 min,"Crime, Film-Noir, Mystery",8.0,"
San Francisco private detective Sam Spade takes on a case that involves him with three eccentric criminals, a gorgeous liar and their quest for a priceless statuette, with the stakes rising after his partner is murdered."
52,Beauty and the Beast,(1991),G,84 min,"Animation, Family, Fantasy",8.0,"
A prince cursed to spend his days as a hideous monster sets out to regain his humanity by earning a young woman's love."
53,Big Fish,(2003),G,125 min,"Adventure, Drama, Fantasy",8.0,"
A frustrated son tries to determine the fact from fiction in his dying father's life."
54,Slumdog Millionaire,(2008),7+,120 min,"Crime, Drama, Romance",8.0,"
A Mumbai teenager reflects on his life after being accused of cheating on the Indian version of ""Who Wants to be a Millionaire?""."
55,Chung Hing sam lam,(1994),PG-13,102 min,"Comedy, Crime, Drama",8.0,"
Two melancholy Hong Kong policemen fall in love: one with a mysterious female underworld figure, the other with a beautiful and ethereal waitress at a late-night restaurant he frequents."
56,Annie Hall,(1977),---,93 min,"Comedy, Romance",8.0,"
Alvy Singer, a divorced Jewish comedian, reflects on his relationship with ex-lover Annie Hall, an aspiring nightclub singer, which ended abruptly just like his previous marriages."
57,Fiddler on the Roof,(1971),---,181 min,"Drama, Family, Musical",8.0,"
In pre-revolutionary Russia, a Jewish peasant with traditional values contends with marrying off three of his daughters with modern romantic ideals while growing anti-Semitic sentiment threatens his village."
58,Cinderella Man,(2005),7+,144 min,"Biography, Drama, Romance",8.0,"
The story of James J. Braddock, a supposedly washed-up boxer who came back to challenge for the heavyweight championship of the world."
59,The Last Picture Show,(1971),R,118 min,"Drama, Romance",8.0,"
In 1951, a group of high schoolers come of age in a bleak, isolated, atrophied North Texas town that is slowly dying, both culturally and economically."
60,Roman Holiday,(1953),---,118 min,"Comedy, Romance",8.0,"
A bored and sheltered princess escapes her guardians and falls in love with an American newsman in Rome."
61,Der Himmel über Berlin,(1987),---,128 min,"Drama, Fantasy, Romance",8.0,"
An angel tires of his purely ethereal life of merely overseeing the human activity of Berlin's residents, and longs for the tangible joys of physical existence when he falls in love with a mortal."
62,La leggenda del pianista sull'oceano,(1998),R,169 min,"Drama, Music, Romance",8.0,"
A baby boy discovered on an ocean liner in 1900 grows into a musical prodigy, never setting foot on land."
63,Out of the Past,(1947),---,97 min,"Crime, Drama, Film-Noir",8.0,"
A private eye escapes his past to run a gas station in a small town, but his past catches up with him. Now he must return to the big city world of danger, corruption, double crosses, and duplicitous dames."
64,Yeopgijeogin geunyeo,(2001),---,137 min,"Comedy, Drama, Romance",8.0,"
A young man sees a drunk, cute woman standing too close to the tracks at a metro station in Seoul and pulls her back. She ends up getting him into trouble repeatedly after that, starting on the train."
65,"Crna macka, beli macor",(1998),R,127 min,"Comedy, Crime, Romance",8.0,"
Matko and his son Zare live on the banks of the Danube river and get by through hustling and basically doing anything to make a living. In order to pay off a business debt Matko agrees to marry off Zare to the sister of a local gangster."
66,Brief Encounter,(1945),---,86 min,"Drama, Romance",8.0,"
Meeting a stranger in a railway station, a woman is tempted to cheat on her husband."
67,Dilwale Dulhania Le Jayenge,(1995),---,189 min,"Drama, Romance",8.0,"
When Raj meets Simran in Europe, it isn't love at first sight but when Simran moves to India for an arranged marriage, love makes its presence felt."
68,Bom yeoreum gaeul gyeoul geurigo bom,(2003),R,103 min,"Drama, Romance",8.0,"
A boy is raised by a Buddhist monk in an isolated floating temple where the years pass like the seasons."
69,My Man Godfrey,(1936),---,94 min,"Comedy, Drama, Romance",8.0,"
A scatterbrained socialite hires a vagrant as a family butler - but there's more to Godfrey than meets the eye."
70,The Shop Around the Corner,(1940),---,99 min,"Comedy, Drama, Romance",8.0,"
Two employees at a gift shop can barely stand each other, without realizing that they are falling in love through the post as each other's anonymous pen pal."
71,Lage Raho Munna Bhai,(2006),---,144 min,"Comedy, Drama, Romance",8.0,"
Munna Bhai embarks on a journey with Mahatma Gandhi in order to fight against a corrupt property dealer."
72,Andaz Apna Apna,(1994),---,160 min,"Action, Comedy, Romance",8.0,"
Two slackers competing for the affections of an heiress inadvertently become her protectors from an evil criminal."
73,Arjun Reddy,(2017),---,182 min,"Action, Drama, Romance",8.0,"
Arjun Reddy, a short tempered house surgeon gets used to drugs and drinks when his girlfriend is forced to marry another person."
74,Puss in Boots: The Last Wish,(2022),6+,102 min,"Animation, Adventure, Comedy",7.9,"
When Puss in Boots discovers that his passion for adventure has taken its toll and he has burned through eight of his nine lives, he launches an epic journey to restore them by finding the mythical Last Wish."
75,Titanic,(1997),13+,194 min,"Drama, Romance",7.9,"
A seventeen-year-old aristocrat falls in love with a kind but poor artist aboard the luxurious, ill-fated R.M.S. Titanic."
76,Shrek,(2001),7+,90 min,"Animation, Adventure, Comedy",7.9,"
A mean lord exiles fairytale creatures to the swamp of a grumpy ogre, who must go on a quest and rescue a princess for the lord in order to get his land back."
77,True Romance,(1993),18+,119 min,"Crime, Drama, Romance",7.9,"
In Detroit, a lonely pop culture geek marries a call girl, steals cocaine from her pimp, and tries to sell it in Hollywood. Meanwhile, the owners of the cocaine, the Mob, track them down in an attempt to reclaim it."
78,Marriage Story,(2019),15+,137 min,"Drama, Romance",7.9,"
Noah Baumbach's incisive and compassionate look at a marriage breaking up and a family staying together."
79,Edward Scissorhands,(1990),7+,105 min,"Drama, Fantasy, Romance",7.9,"
The solitary life of an artificial man - who was incompletely constructed and has scissors for hands - is upended when he is taken in by a suburban family."
80,Wo hu cang long,(2000),16+,120 min,"Action, Adventure, Drama",7.9,"
A young Chinese warrior steals a sword from a famed swordsman and then escapes into a world of romantic adventure with a mysterious man in the frontier of the nation."
81,Mildred Pierce,(1945),---,111 min,"Crime, Drama, Film-Noir",7.9,"
A hard-working mother inches towards disaster as she divorces her husband and starts a successful restaurant business to support her spoiled daughter."
82,Charade,(1963),DİKKAT,113 min,"Comedy, Mystery, Romance",7.9,"
Romance and suspense ensue in Paris as a woman is pursued by several men who want a fortune her murdered husband had stolen. Whom can she trust?"
83,Låt den rätte komma in,(2008),15+,114 min,"Drama, Fantasy, Horror",7.9,"
Oskar, an overlooked and bullied boy, finds love and revenge through Eli, a beautiful but peculiar girl."
84,Doctor Zhivago,(1965),PG-13,197 min,"Drama, Romance, War",7.9,"
The life of a Russian physician and poet who, although married to another, falls in love with a political activist's wife and experiences hardship during World War I and then the October Revolution."
85,Before Midnight,(2013),18+,109 min,"Drama, Romance",7.9,"
We meet Jesse and Celine nine years on in Greece. Almost two decades have passed since their first meeting on that train bound for Vienna."
86,Sing Street,(2016),PG-13,106 min,"Comedy, Drama, Music",7.9,"
A boy growing up in Dublin during the 1980s escapes his strained family life by starting a band to impress the mysterious girl he likes."
87,Trois couleurs: Bleu,(1993),15+,94 min,"Drama, Music, Mystery",7.9,"
A woman struggles to find a way to live her life after the death of her husband and child."
88,The Artist,(I) (2011),G,100 min,"Comedy, Drama, Romance",7.9,"
An egomaniacal film star develops a relationship with a young dancer against the backdrop of Hollywood's silent era."
89,Harold and Maude,(1971),---,91 min,"Comedy, Drama, Romance",7.9,"
Young, rich, and obsessed with death, Harold finds himself changed forever when he meets lively septuagenarian Maude at a funeral."
90,Mimi wo sumaseba,(1995),7+,111 min,"Animation, Drama, Family",7.9,"
A love story between a girl who loves reading books, and a boy who has previously checked out all of the library books she chooses."
91,Notorious,(1946),---,102 min,"Drama, Film-Noir, Romance",7.9,"
The daughter of a convicted Nazi spy is asked by American agents to gather information on a ring of Nazi scientists in South America. How far will she have to go to ingratiate herself with them?"
92,The Philadelphia Story,(1940),---,112 min,"Comedy, Romance",7.9,"
When a rich woman's ex-husband and a tabloid-type reporter turn up just before her planned remarriage, she begins to learn the truth about herself."
93,The Adventures of Robin Hood,(1938),PG,102 min,"Action, Adventure, Romance",7.9,"
When Prince John and the Norman Lords begin oppressing the Saxon masses in King Richard's absence in 1190s England, a Saxon lord fights back as the outlaw leader of a resistance movement."
94,Hable con ella,(2002),15+,112 min,"Drama, Mystery, Romance",7.9,"
Two men share an odd friendship while they care for two women who are both in deep comas."
95,Bin-jip,(2004),R,88 min,"Crime, Drama, Romance",7.9,"
A transient young man breaks into empty homes to partake of the vacationing residents' lives for a few days."
96,In a Lonely Place,(1950),---,94 min,"Drama, Film-Noir, Mystery",7.9,"
A potentially violent screenwriter is a murder suspect until his lovely neighbor clears him. However, she soon starts to have her doubts."
97,Gegen die Wand,(2004),18+,121 min,"Drama, Romance",7.9,"
With the intention to break free from the strict familial restrictions, a suicidal young woman sets up a marriage of convenience with a forty-year-old addict, an act that will lead to an outburst of envious love."
98,My Name Is Khan,(2010),PG-13,165 min,"Adventure, Drama, Romance",7.9,"
An Indian Muslim man with Asperger's syndrome takes a challenge to speak to the President of the United States seriously and embarks on a cross-country journey."
99,The Thin Man,(1934),---,91 min,"Comedy, Crime, Mystery",7.9,"
Former detective Nick Charles and his wealthy wife Nora investigate a murder case, mostly for the fun of it."
100,Kal Ho Naa Ho,(2003),---,186 min,"Comedy, Drama, Musical",7.9,"
Naina, an introverted, perpetually depressed girl's life changes when she meets Aman. But Aman has a secret of his own which changes their lives forever. Embroiled in all this is Rohit, Naina's best friend who conceals his love for her."
101,Gully Boy,(2019),---,154 min,"Drama, Music, Romance",7.9,"
A coming-of-age story based on the lives of street rappers in Mumbai."
102,Jab We Met,(2007),---,138 min,"Comedy, Drama, Romance",7.9,"
A depressed wealthy businessman finds his life changing after he meets a spunky and care-free young woman."
103,Hiroshima mon amour,(1959),---,90 min,"Drama, Romance",7.9,"
A French actress filming an anti-war film in Hiroshima has an affair with a married Japanese architect as they share their differing perspectives on war."
104,Hoje Eu Quero Voltar Sozinho,(2014),---,96 min,"Drama, Romance",7.9,"
Leonardo is a blind teenager searching for independence. His everyday life, the relationship with his best friend Giovana, and the way he sees the world change completely with the arrival of Gabriel."
105,La Belle et la Bête,(1946),---,96 min,"Drama, Fantasy, Romance",7.9,"
A beautiful young woman takes her father's place as the prisoner of a mysterious beast, who wishes to marry her."
106,Sullivan's Travels,(1941),---,90 min,"Adventure, Comedy, Drama",7.9,"
Hollywood director John L. Sullivan sets out to experience life as a homeless person in order to gain relevant life experience for his next movie."
107,Dev.D,(2009),---,144 min,"Comedy, Drama, Romance",7.9,"
After breaking up with his childhood sweetheart, a young man finds solace in drugs. Meanwhile, a teenage girl is caught in the world of prostitution. Will they be destroyed, or will they find redemption?"
108,My Fair Lady,(1964),7+,170 min,"Drama, Family, Musical",7.8,"
In 1910s London, snobbish phonetics professor Henry Higgins agrees to a wager that he can make crude flower girl, Eliza Doolittle, presentable in high society."
109,Pride & Prejudice,(2005),13+,129 min,"Drama, Romance",7.8,"
Sparks fly when spirited Elizabeth Bennet meets single, rich, and proud Mr. Darcy. But Mr. Darcy reluctantly finds himself falling in love with a woman beneath his class. Can each overcome their own pride and prejudice?"
110,The Notebook,(2004),13A,123 min,"Drama, Romance",7.8,"
A poor yet passionate young man (Ryan Gosling) falls in love with a rich young woman (Rachel McAdams), giving her a sense of freedom, but they are soon separated because of their social differences."
111,Little Women,(2019),G,135 min,"Drama, Romance",7.8,"
Jo March reflects back and forth on her life, telling the beloved story of the March sisters - four young women, each determined to live life on her own terms."
112,Call Me by Your Name,(2017),18+,132 min,"Drama, Romance",7.8,"
In 1980s Italy, romance blossoms between a seventeen-year-old student and the older man hired as his father's research assistant."
113,Atonement,(2007),18+,123 min,"Drama, Mystery, Romance",7.8,"
Thirteen-year-old fledgling writer Briony Tallis irrevocably changes the course of several lives when she accuses her older sister's lover of a crime he did not commit."
114,Verdens verste menneske,(2021),18+,128 min,"Comedy, Drama, Romance",7.8,"
The chronicles of four years in the life of Julie, a young woman who navigates the troubled waters of her love life and struggles to find her career path, leading her to take a realistic look at who she really is."
115,About Time,(I) (2013),7+,123 min,"Comedy, Drama, Fantasy",7.8,"
At the age of 21, Tim discovers he can travel in time and change what happens and has happened in his own life. His decision to make his world a better place by getting a girlfriend turns out not to be as easy as you might think."
116,Cast Away,(2000),13+,143 min,"Adventure, Drama, Romance",7.8,"
A FedEx executive undergoes a physical and emotional transformation after crash landing on a deserted island."
