,0,1,2,3,4,5,6
231,The Hours,(2002),13+,110 min,"Drama, Romance",7.5,"
The story of how the novel ""Mrs. Dalloway"" affects three generations of women, all of whom, in one way or another, have had to deal with suicide in their lives."
232,Hair,(1979),---,121 min,"Comedy, Drama, Musical",7.5,"
Claude Bukowski leaves the family ranch in Oklahoma for New York where he is rapidly embraced into the hippie group of youngsters led by Berger, yet he's already been drafted. He soon falls in love with Sheila Franklin, a rich girl but still a rebel inside."
233,A Single Man,(2009),15+,99 min,"Crime, Drama, Romance",7.5,"
An English professor, one year after the sudden death of his boyfriend, is unable to cope with his typical days in 1960s Los Angeles."
234,The Big Sick,(2017),16+,120 min,"Comedy, Drama, Romance",7.5,"
Pakistan-born comedian Kumail Nanjiani and grad student Emily Gardner fall in love but struggle as their cultures clash. When Emily contracts a mysterious illness, Kumail finds himself forced to face her feisty parents, his family's expectations, and his true feelings."
235,Freddy,(2022),---,124 min,"Drama, Mystery, Romance",7.5,"
The lines between love and obsession blur in this romantic thriller packed with unpredictable twists and sharp turns."
236,Stranger Than Fiction,(2006),13+,113 min,"Comedy, Drama, Fantasy",7.5,"
I.R.S. auditor Harold Crick suddenly finds his mundane Chicago life to be the subject of narration only he can hear: narration that begins to affect his entire existence, from his work to his love life to his death."
237,The Time Machine,(1960),---,103 min,"Adventure, Romance, Sci-Fi",7.5,"
A man's vision for a utopian society is disillusioned when travelling forward into time reveals a dark and dangerous society."
238,Le mépris,(1963),---,103 min,"Drama, Romance",7.5,"
Screenwriter Paul Javal's marriage to his wife Camille disintegrates during movie production as she spends time with the producer. Layered conflicts between art and business ensue."
239,En kongelig affære,(2012),13A,137 min,"Biography, Drama, History",7.5,"
A young queen, who is married to an insane king, falls secretly in love with her physician - and together they start a revolution that changes a nation forever."
240,Ne le dis à personne,(2006),7+,131 min,"Crime, Drama, Mystery",7.5,"
An accidental discovery near a doctor's estate stirs up some painful memories eight years after his wife's hideous murder, and now, things are bound to take a turn for the unexpected. Does the good doctor know more than he's letting on?"
241,Shi mian mai fu,(2004),PG-13,119 min,"Action, Adventure, Drama",7.5,"
A romantic police captain breaks a beautiful member of a rebel group out of prison to help her rejoin her fellows, but things are not what they seem."
242,Zimna wojna,(2018),13+,89 min,"Drama, Music, Romance",7.5,"
In the 1950s, a music director falls in love with a singer and tries to persuade her to flee communist Poland for France."
243,Fruitvale Station,(2013),15+,85 min,"Biography, Crime, Drama",7.5,"
The story of Oscar Grant III, a 22-year-old Bay Area resident, who crosses paths with friends, enemies, family, and strangers on the last day of 2008."
244,Kuch Kuch Hota Hai,(1998),---,177 min,"Comedy, Drama, Musical",7.5,"
During their college years, Anjali was in love with her best-friend Rahul, but he had eyes only for Tina. Years later, Rahul and the now-deceased Tina's eight-year-old daughter attempts to reunite her father and Anjali."
245,The Great Debaters,(2007),PG-13,126 min,"Biography, Drama, Romance",7.5,"
A drama based on the true story of Melvin B. Tolson, a professor at Wiley College Texas. In 1935, he inspired students to form the school's first debate team, which went on to challenge Harvard in the national championship."
246,Meet Me in St. Louis,(1944),---,113 min,"Comedy, Drama, Family",7.5,"
Young love and childish fears highlight a year in the life of a turn-of-the-century family."
247,Fucking Åmål,(1998),---,89 min,"Comedy, Drama, Romance",7.5,"
Two teenage girls in small-town Sweden. Elin is beautiful, popular, and bored with life. Agnes is friendless, sad, and secretly in love with Elin."
248,Jin ling shi san chai,(2011),R,146 min,"Drama, History, Romance",7.5,"
An American finds refuge during the 1937 Japanese invasion of Nanking in a church with a group of women. Posing as a priest, he attempts to lead the women to safety."
249,Pierrot le fou,(1965),---,110 min,"Crime, Drama, Romance",7.5,"
Pierrot escapes his boring society and travels from Paris to the Mediterranean Sea with Marianne, a girl chased by hit-men from Algeria. They lead an unorthodox life, always on the run."
250,Devdas,(I) (2002),---,185 min,"Drama, Musical, Romance",7.5,"
After his wealthy family prohibits him from marrying the woman he is in love with, Devdas Mukherjee's life spirals further and further out of control as he takes up alcohol and a life of vice to numb the pain."
251,Spellbound,(1945),---,111 min,"Film-Noir, Mystery, Romance",7.5,"
A psychiatrist protects the identity of an amnesia patient accused of murder while attempting to recover his memory."
252,Jeux d'enfants,(2003),15+,93 min,"Comedy, Drama, Romance",7.5,"
As adults, best friends Julien and Sophie continue the odd game they started as children -- a fearless competition to outdo one another with daring and outrageous stunts. While they often act out to relieve one another's pain, their game might be a way to avoid the fact that they are truly meant for one another."
253,White Christmas,(1954),---,120 min,"Comedy, Musical, Romance",7.5,"
A successful song-and-dance team become romantically involved with a sister act and team up to save the failing Vermont inn of their former commanding general."
254,Dil Se..,(1998),---,144 min,"Drama, Romance",7.5,"
A radio broadcaster's intense attraction to a mysterious woman opens the door to a tidal wave of powerful emotions and desires."
255,How to Steal a Million,(1966),---,123 min,"Comedy, Crime, Romance",7.5,"
The daughter of an art forger teams up with a burglar to steal one of her father's forgeries and protect his secret."
256,Cyrano de Bergerac,(1990),---,137 min,"Comedy, Drama, History",7.5,"
Famed swordsman and poet Cyrano de Bergerac is in love with his cousin Roxane. He has never expressed his love for her as he his large nose undermines his self-confidence. Then he finds a way to express his love to her, indirectly."
257,J'ai perdu mon corps,(2019),7+,81 min,"Animation, Drama, Fantasy",7.5,"
A story of Naoufel, a young man who is in love with Gabrielle. In another part of town, a severed hand escapes from a dissection lab, determined to find its body again."
258,Teströl és lélekröl,(2017),15+,116 min,"Drama, Fantasy, Mystery",7.5,"
When slaughterhouse workers Endre and Mária discover they share the same dreams, where they meet in a forest as deer and fall in love, they decide to make their dreams come true, but it's difficult in real life."
259,Jodhaa Akbar,(2008),---,213 min,"Action, Drama, History",7.5,"
A sixteenth century love story about a marriage of alliance that gave birth to true love between a great Mughal emperor, Akbar, and a Rajput princess, Jodha."
260,Husbands and Wives,(1992),R,108 min,"Comedy, Drama, Romance",7.5,"
When their best friends announce that they're separating, a professor and his wife discover the faults in their own marriage."
261,Les invasions barbares,(2003),R,99 min,"Comedy, Crime, Drama",7.5,"
During his final days, a dying man is reunited with old friends, former lovers, his ex-wife, and his estranged son."
262,Malèna,(2000),18+,108 min,"Drama, Romance, War",7.4,"
Amidst the war climate, a teenage boy discovering himself becomes love-stricken by Malèna, a sensual woman living in a small, narrow-minded Italian town."
263,Dracula,(1992),18+,128 min,"Drama, Fantasy, Horror",7.4,"
The centuries old vampire Count Dracula comes to England to seduce his barrister Jonathan Harker's fiancée Mina Murray and inflict havoc in the foreign land."
264,"Crazy, Stupid, Love.",(2011),7+,118 min,"Comedy, Drama, Romance",7.4,"
A middle-aged husband's life changes dramatically when his wife asks him for a divorce. He seeks to rediscover his manhood with the help of a newfound friend, Jacob, learning to pick up girls at bars."
265,Me Before You,(2016),13A,106 min,"Drama, Romance",7.4,"
A girl in a small town forms an unlikely bond with a recently-paralyzed man she's taking care of."
266,Garden State,(2004),R,102 min,"Comedy, Drama, Romance",7.4,"
A quietly troubled young man returns home for his mother's funeral after being estranged from his family for a decade."
267,Up in the Air,(I) (2009),15+,109 min,"Comedy, Drama, Romance",7.4,"
Ryan Bingham enjoys living out of a suitcase for his job, travelling around the country firing people, but finds that lifestyle threatened by the presence of a potential love interest, and a new hire presenting a new business model."
268,The English Patient,(1996),15A,162 min,"Drama, Romance, War",7.4,"
At the close of World War II, a young nurse tends to a badly-burned plane crash victim. His past is shown in flashbacks, revealing an involvement in a fateful love affair."
269,Palm Springs,(2020),16+,90 min,"Comedy, Fantasy, Mystery",7.4,"
Stuck in a time loop, two wedding guests develop a budding romance while living the same day over and over again."
270,Downton Abbey: A New Era,(2022),PG,124 min,"Drama, Romance",7.4,"
The Crawley family goes on a grand journey to the South of France to uncover the mystery of the dowager countess's newly inherited villa."
271,High Fidelity,(2000),R,113 min,"Comedy, Drama, Music",7.4,"
Rob, a record store owner and compulsive list maker, recounts his top five breakups, including the one in progress."
272,Witness,(1985),---,112 min,"Drama, Romance, Thriller",7.4,"
When a young Amish boy is sole witness to a murder while visiting Philadelphia with his mother, police detective John Book tries to protect the boy until an attempt on Book's life forces him into hiding in Amish country."
273,Phantom Thread,(2017),15+,130 min,"Drama, Romance",7.4,"
Set in 1950s London, Reynolds Woodcock is a renowned dressmaker whose fastidious life is disrupted by a young, strong-willed woman, Alma, who becomes his muse and lover."
274,Downton Abbey,(2019),7+,122 min,"Drama, Romance",7.4,"
The continuing story of the Crawley family, wealthy owners of a large estate in the English countryside in the early twentieth century."
275,The Constant Gardener,(2005),R,129 min,"Drama, Mystery, Romance",7.4,"
A widower is determined to get to the bottom of a potentially explosive secret involving his wife's murder, big business, and corporate corruption."
276,Body Heat,(1981),---,113 min,"Crime, Drama, Romance",7.4,"
In the midst of a searing Florida heat wave, a woman persuades her lover, a small-town lawyer, to murder her rich husband."
277,Koto no ha no niwa,(2013),---,46 min,"Animation, Drama, Romance",7.4,"
A 15-year-old boy and 27-year-old woman find an unlikely friendship one rainy day in the Shinjuku Gyoen National Garden."
278,Tootsie,(1982),---,116 min,"Comedy, Drama, Romance",7.4,"
Michael Dorsey, an unsuccessful actor, disguises himself as a woman in order to get a role on a trashy hospital soap."
279,Open Range,(2003),R,139 min,"Action, Drama, Romance",7.4,"
A former gunslinger is forced to take up arms again when he and his cattle crew are threatened by a corrupt lawman."
280,The Terminal,(2004),13+,128 min,"Comedy, Drama, Romance",7.4,"
An Eastern European tourist unexpectedly finds himself stranded in JFK airport, and must take up temporary residence there."
281,Begin Again,(II) (2013),R,104 min,"Comedy, Drama, Music",7.4,"
A chance encounter between a down-and-out music-business executive and a young singer-songwriter, new to Manhattan, turns into a promising collaboration between the two talents."
282,Frances Ha,(2012),G,86 min,"Comedy, Drama, Romance",7.4,"
A New York woman apprentices for a dance company and throws herself headlong into her dreams, even as the possibility of realizing them dwindles."
283,Buffalo '66,(1998),R,110 min,"Comedy, Drama, Romance",7.4,"
After being released from prison, Billy is set to visit his parents with his wife, whom he does not actually have. This provokes Billy to act out, as he kidnaps a girl and forces her to act as his wife for the visit."
284,Durante la tormenta,(2018),18+,128 min,"Drama, Fantasy, Mystery",7.4,"
Two storms separated by 25 years. A woman murdered. A daughter missed. Only 72 hours to discover the truth."
285,Notes on a Scandal,(2006),R,92 min,"Crime, Drama, Romance",7.4,"
A veteran high school teacher befriends a younger art teacher, who is having an affair with one of her fifteen-year-old students. However, her intentions with this new ""friend"" also go well beyond a platonic friendship."
286,The Cider House Rules,(1999),PG-13,126 min,"Drama, Romance",7.4,"
A compassionate young man, raised in an orphanage and trained to be a doctor there, decides to leave to see the world."
287,A Hidden Life,(2019),G,174 min,"Biography, Drama, Romance",7.4,"
The Austrian Franz Jägerstätter, a conscientious objector, refuses to fight for the Nazis in World War II."
288,To Catch a Thief,(1955),PG,106 min,"Mystery, Romance, Thriller",7.4,"
A retired jewel thief sets out to prove his innocence after being suspected of returning to his former occupation."
289,The Legend,(2022),---,161 min,"Action, Drama, Romance",7.4,"
Saravanan, a foreign-educated researcher returns to his native place in India. His family runs colleges and hospitals. He crosses swords with a filthy-rich medical mafia with only commercial intentions."
290,De rouille et d'os,(2012),15+,120 min,"Drama, Romance",7.4,"
Put in charge of his young son, Alain leaves Belgium for Antibes to live with his sister and her husband as a family. Alain's bond with Stephanie, a killer whale trainer, grows deeper after Stephanie suffers a horrible accident."
291,Les Misérables,(1998),16+,134 min,"Crime, Drama, Romance",7.4,"
Valjean, a former criminal, has atoned for his past and now finds himself in the midst of the French Revolution, avoiding a law-obsessed policeman hell-bent on capturing him."
292,Howards End,(1992),PG,142 min,"Drama, Romance",7.4,"
A businessman thwarts his wife's bequest of an estate to another woman."
293,SLC Punk!,(1998),R,97 min,"Comedy, Drama, Music",7.4,"
In the early 1980s Stevo, and Heroin Bob are the only two dedicated punks in conservative Salt Lake City."
294,Kabhi Khushi Kabhie Gham...,(2001),---,210 min,"Drama, Musical, Romance",7.4,"
After marrying a poor woman, rich Rahul is disowned by his father and moves to London to build a new life. Years later, his now-grown younger brother Rohan embarks on a mission to bring Rahul back home and reunite the family."
295,The Painted Veil,(2006),PG-13,125 min,"Drama, Romance",7.4,"
A British medical doctor fights a cholera epidemic in a small Chinese village, while being trapped at home in a loveless marriage to an unfaithful wife."
296,2046,(2004),13+,129 min,"Drama, Romance, Sci-Fi",7.4,"
Several women enter a science fiction author's life over the course of a few years, after the author has lost the woman he considers his one true love."
297,The King and I,(1956),---,133 min,"Biography, Drama, Musical",7.4,"
A widow accepts a job as a live-in governess to the King of Siam's children."
298,Kokuriko-zaka kara,(2011),PG,91 min,"Animation, Comedy, Drama",7.4,"
A group of Yokohama teens look to save their school's clubhouse from the wrecking ball in preparations for the 1964 Tokyo Olympics."
299,Biutiful,(2010),15+,148 min,"Drama, Romance",7.4,"
A man dying of cancer tries his best to leave the world on his own terms."
