,0,1,2,3,4,5,6
117,The Curious Case of Benjamin Button,(2008),G,166 min,"Drama, Fantasy, Romance",7.8,"
Tells the story of Benjamin Button, a man who starts aging backwards with consequences."
118,Moonrise Kingdom,(2012),13A,94 min,"Comedy, Drama, Family",7.8,"
A pair of young lovers flee their New England town, which causes a local search party to fan out to find them."
119,Mr. Nobody,(2009),R,141 min,"Drama, Fantasy, Romance",7.8,"
A boy stands on a station platform as a train is about to leave. Should he go with his mother or stay with his father? Infinite possibilities arise from this decision. As long as he doesn't choose, anything is possible."
120,To Have and Have Not,(1944),---,100 min,"Adventure, Comedy, Film-Noir",7.8,"
During World War II, American expatriate Harry Morgan helps transport a French Resistance leader and his beautiful wife to Martinique while romancing a sensuous lounge singer."
121,Walk the Line,(2005),G,136 min,"Biography, Drama, Music",7.8,"
A chronicle of country music legend Johnny Cash's life, from his early days on an Arkansas cotton farm to his rise to fame with Sun Records in Memphis, where he recorded alongside Elvis Presley, Jerry Lee Lewis, and Carl Perkins."
122,The Remains of the Day,(1993),13+,134 min,"Drama, Romance",7.8,"
A butler who sacrificed body and soul to service in the years leading up to World War II realizes too late how misguided his loyalty was to his lordly employer."
123,Cabaret,(1972),---,124 min,"Drama, Music, Musical",7.8,"
A female girlie club entertainer in Weimar Republic era Berlin romances two men while the Nazi Party rises to power around them."
124,La migliore offerta,(2013),R,131 min,"Crime, Drama, Mystery",7.8,"
A lonely art expert working for a mysterious and reclusive heiress finds not only her art worth examining."
125,Once,(I) (2007),R,86 min,"Drama, Music, Romance",7.8,"
A modern-day musical about a busker and an immigrant and their eventful week in Dublin, as they write, rehearse and record songs that tell their love story."
126,Gaslight,(1944),---,114 min,"Crime, Drama, Mystery",7.8,"
Ten years after her aunt was murdered in their London home, a woman returns from Italy in the 1880s to resume residence with her new husband. His obsessive interest in the home rises from a secret that may require driving his wife insane."
127,Manhattan,(1979),---,96 min,"Comedy, Drama, Romance",7.8,"
The life of a divorced television writer dating a teenage girl is further complicated when he falls in love with his best friend's mistress."
128,Pride,(I) (2014),15A,119 min,"Biography, Comedy, Drama",7.8,"
U.K. gay activists work to help miners during their lengthy strike of the National Union of Mineworkers in the summer of 1984."
129,Days of Heaven,(1978),---,94 min,"Drama, Romance",7.8,"
A hot-tempered farm laborer convinces the woman he loves to marry their rich but dying boss so that they can have a claim to his fortune."
130,Great Expectations,(1946),---,118 min,"Adventure, Drama, Mystery",7.8,"
A humble orphan boy in 1810s Kent is given the opportunity to go to London and become a gentleman, with the help of an unknown benefactor."
131,You Can't Take It with You,(1938),---,126 min,"Comedy, Drama, Romance",7.8,"
The son of a snobbish Wall Street banker becomes engaged to a woman from a good-natured but decidedly eccentric family, not realizing that his father is trying to force her family from their home for a real estate development."
132,His Girl Friday,(1940),---,92 min,"Comedy, Drama, Romance",7.8,"
A newspaper editor uses every trick in the book to keep his ace reporter ex-wife from remarrying."
133,The Lunchbox,(2013),G,104 min,"Drama, Romance",7.8,"
A mistaken delivery in Mumbai's famously efficient lunchbox delivery system connects a young housewife to an older man in the dusk of his life as they build a fantasy world together through notes in the lunchbox."
134,Il postino,(1994),PG,108 min,"Biography, Comedy, Drama",7.8,"
A simple Italian postman learns to love poetry while delivering mail to a famous poet, and then uses this to woo local beauty Beatrice."
135,Les parapluies de Cherbourg,(1964),---,91 min,"Drama, Musical, Romance",7.8,"
A young woman separated from her lover by war faces a life-altering decision."
136,Sennen joyû,(2001),PG,87 min,"Animation, Drama, Fantasy",7.8,"
A TV interviewer and his cameraman meet a former actress and travel through her memories and career."
137,L'avventura,(1960),---,144 min,"Drama, Mystery, Romance",7.8,"
A woman disappears during a Mediterranean boating trip. During the search, her lover and her best friend become attracted to each other."
138,Veer-Zaara,(2004),---,192 min,"Drama, Family, Musical",7.8,"
""Veer-Zaara"" is a saga of love, separation, courage, and sacrifice. A love story that is an inspiration and will remain a legend forever."
139,Vicky Donor,(2012),---,126 min,"Comedy, Romance",7.8,"
A man is brought in by an infertility doctor to supply him with his sperm, where he becomes the biggest sperm donor for his clinic."
140,La vie d'Adèle,(2013),18+,180 min,"Drama, Romance",7.7,"
Adèle's life is changed when she meets Emma, a young woman with blue hair, who will allow her to discover desire and to assert herself as a woman and as an adult. In front of others, Adèle grows, seeks herself, loses herself, and ultimately finds herself through love and loss."
141,Brokeback Mountain,(2005),15+,134 min,"Drama, Romance",7.7,"
Ennis and Jack are two shepherds who develop a sexual and emotional relationship. Their relationship becomes complicated when both of them get married to their respective girlfriends."
142,Tangled,(2010),G,100 min,"Animation, Adventure, Comedy",7.7,"
The magically long-haired Rapunzel has spent her entire life in a tower, but now that a runaway thief has stumbled upon her, she is about to discover the world for the first time, and who she really is."
143,(500) Days of Summer,(2009),G,95 min,"Comedy, Drama, Romance",7.7,"
After being dumped by the girl he believes to be his soulmate, hopeless romantic Tom Hansen reflects on their relationship to try and figure out where things went wrong and how he can win her back."
144,The Last of the Mohicans,(1992),18+,112 min,"Action, Adventure, Drama",7.7,"
Three trappers protect the daughters of a British Colonel in the midst of the French and Indian War."
145,As Good as It Gets,(1997),13+,139 min,"Comedy, Drama, Romance",7.7,"
A single mother and waitress, a misanthropic author, and a gay artist form an unlikely friendship after the artist is assaulted in a robbery."
146,Silver Linings Playbook,(2012),15+,122 min,"Comedy, Drama, Romance",7.7,"
After a stint in a mental institution, former teacher Pat Solitano moves back in with his parents and tries to reconcile with his ex-wife. Things get more challenging when Pat meets Tiffany, a mysterious girl with problems of her own."
147,En man som heter Ove,(2015),PG-13,116 min,"Comedy, Drama, Romance",7.7,"
Ove, an ill-tempered, isolated retiree who spends his days enforcing block association rules and visiting his wife's grave, has finally given up on life just as an unlikely friendship develops with his boisterous new neighbors."
148,Sense and Sensibility,(1995),7+,136 min,"Drama, Romance",7.7,"
Rich Mr. Dashwood dies, leaving his second wife and her three daughters poor by the rules of inheritance. The two eldest daughters are the title opposites."
149,Midnight in Paris,(2011),13A,94 min,"Comedy, Fantasy, Romance",7.7,"
While on a trip to Paris with his fiancée's family, a nostalgic screenwriter finds himself mysteriously going back to the 1920s every day at midnight."
150,The Fault in Our Stars,(2014),13A,126 min,"Drama, Romance",7.7,"
Two teenage cancer patients begin a life-affirming journey to visit a reclusive author in Amsterdam."
151,The Theory of Everything,(2014),7+,123 min,"Biography, Drama, Romance",7.7,"
A look at the relationship between the famous physicist Stephen Hawking and his wife."
152,When Harry Met Sally...,(1989),---,95 min,"Comedy, Drama, Romance",7.7,"
Harry and Sally have known each other for years, and are very good friends, but they fear sex would ruin the friendship."
153,Flipped,(I) (2010),7A,90 min,"Comedy, Drama, Romance",7.7,"
Two eighth-graders start to have feelings for each other despite being total opposites."
154,Kaze tachinu,(2013),13+,126 min,"Animation, Biography, Drama",7.7,"
A look at the life of Jiro Horikoshi, the man who designed Japanese fighter planes during World War II."
155,Belle de jour,(1967),R,100 min,"Drama, Romance",7.7,"
A frigid young housewife decides to spend her midweek afternoons as a prostitute."
156,The African Queen,(1951),PG,105 min,"Adventure, Drama, Romance",7.7,"
In WWI East Africa, a gin-swilling Canadian riverboat captain is persuaded by a strait-laced English missionary to undertake a trip up a treacherous river and use his boat to attack a German gunship."
157,The Quiet Man,(1952),---,129 min,"Comedy, Drama, Romance",7.7,"
A retired American boxer returns to the village of his birth in 1920s Ireland, where he falls for a spirited redhead whose brother is contemptuous of their union."
158,Me and Earl and the Dying Girl,(2015),18+,105 min,"Comedy, Drama, Romance",7.7,"
High schooler Greg, who spends most of his time making parodies of classic movies with his co-worker Earl, finds his outlook forever altered after befriending a classmate who has just been diagnosed with cancer."
159,Good Bye Lenin!,(2003),R,121 min,"Comedy, Drama, Romance",7.7,"
In 1990, to protect his fragile mother from a fatal shock after a long coma, a young man must keep her from learning that her beloved nation of East Germany as she knew it has disappeared."
160,Chun gwong cha sit,(1997),---,96 min,"Drama, Romance",7.7,"
A couple take a trip to Argentina but both men find their lives drifting apart in opposite directions."
161,La double vie de Véronique,(1991),13+,98 min,"Drama, Fantasy, Music",7.7,"
Two parallel stories about two identical women; one living in Poland, the other in France. They don't know each other, but their lives are nevertheless profoundly connected."
162,Toki o kakeru shôjo,(2006),---,98 min,"Animation, Adventure, Comedy",7.7,"
A high-school girl named Makoto acquires the power to travel back in time, and decides to use it for her own personal benefits. Little does she know that she is affecting the lives of others just as much as she is her own."
163,The Broken Circle Breakdown,(2012),18+,111 min,"Drama, Music, Romance",7.7,"
Elise and Didier fall in love at first sight, in spite of their differences. He talks, she listens. He's a romantic atheist, she's a religious realist. When their daughter becomes seriously ill, their love is put on trial."
164,Hana-bi,(1997),---,103 min,"Crime, Drama, Romance",7.7,"
Nishi leaves the police in the face of harrowing personal and professional difficulties. Spiraling into depression, he makes questionable decisions."
165,Rockstar,(2011),---,159 min,"Drama, Music, Romance",7.7,"
Janardhan Jakhar chases his dreams of becoming a big Rock star, during which he falls in love with Heer."
166,Marty,(1955),---,90 min,"Drama, Romance",7.7,"
A middle-aged butcher and a school teacher who have given up on the idea of love meet at a dance and fall for each other."
167,Jules et Jim,(1962),---,105 min,"Drama, Romance",7.7,"
Decades of a love triangle concerning two friends and an impulsive woman."
168,The Purple Rose of Cairo,(1985),---,82 min,"Comedy, Fantasy, Romance",7.7,"
In 1935 New Jersey, a movie character walks off the screen and into the real world."
169,Joyeux Noël,(2005),PG-13,116 min,"Drama, History, Music",7.7,"
In December 1914, an unofficial Christmas truce on the Western Front allows soldiers from opposing sides of the First World War to gain insight into each other's way of life."
170,Kapoor & Sons,(2016),---,132 min,"Comedy, Drama, Family",7.7,"
The story about two brothers who visit their dysfunctional family for their grandfather's birthday party."
171,The Birds,(1963),G,119 min,"Drama, Horror, Mystery",7.6,"
A wealthy San Francisco socialite pursues a potential boyfriend to a small Northern California town that slowly takes a turn for the bizarre when birds of all kinds suddenly begin to attack people."
172,Moulin Rouge!,(2001),13+,127 min,"Drama, Musical, Romance",7.6,"
A poor Bohemian poet in 1890s Paris falls for a beautiful courtesan and nightclub star coveted by a jealous duke."
173,Love Actually,(2003),18+,135 min,"Comedy, Drama, Romance",7.6,"
Follows the lives of eight very different couples in dealing with their love lives in various loosely interrelated tales all set during a frantic month before Christmas in London, England."
174,Stardust,(2007),13+,127 min,"Adventure, Family, Fantasy",7.6,"
In a countryside town bordering on a magical land, a young man makes a promise to his beloved that he'll retrieve a fallen star by venturing into the magical realm."
175,A Star Is Born,(2018),15+,136 min,"Drama, Music, Romance",7.6,"
A musician helps a young singer find fame as age and alcoholism send his own career into a downward spiral."
176,The Little Mermaid,(1989),G,83 min,"Animation, Adventure, Family",7.6,"
A mermaid princess makes a Faustian bargain in an attempt to become human and win a prince's love."
177,The Reader,(2008),15+,124 min,"Drama, Romance",7.6,"
Post-WWII Germany: Nearly a decade after his affair with an older woman came to a mysterious end, law student Michael Berg re-encounters his former lover as she defends herself in a war-crime trial."
178,The Shootist,(1976),---,100 min,"Drama, Romance, Western",7.6,"
A dying gunfighter spends his last days looking for a way to die with a minimum of pain and a maximum of dignity."
179,Romeo and Juliet,(1968),13+,138 min,"Drama, Romance",7.6,"
When two young members of feuding families meet, forbidden love ensues."
180,Breakfast at Tiffany's,(1961),7+,115 min,"Comedy, Drama, Romance",7.6,"
A young New York socialite becomes interested in a young man who has moved into her apartment building, but her past threatens to get in the way."
181,Rushmore,(1998),15+,93 min,"Comedy, Drama, Romance",7.6,"
A teenager at Rushmore Academy falls for a much older teacher and befriends a middle-aged industrialist. Later, he finds out that his love interest and his friend are having an affair, which prompts him to begin a vendetta."
182,Do lok tin si,(1995),---,99 min,"Comedy, Crime, Drama",7.6,"
This Hong Kong-set crime drama follows the lives of a hitman, hoping to get out of the business, and his elusive female partner."
183,Match Point,(2005),13+,124 min,"Drama, Romance, Thriller",7.6,"
At a turning point in his life, a former tennis pro falls for an actress who happens to be dating his friend and soon-to-be brother-in-law."
184,West Side Story,(1961),7+,153 min,"Crime, Drama, Musical",7.6,"
Two youngsters from rival New York City gangs fall in love, but tensions between their respective friends build toward tragedy."
185,Snow White and the Seven Dwarfs,(1937),Approved,83 min,"Animation, Adventure, Family",7.6,"
Exiled into the dangerous forest by her wicked stepmother, a princess is rescued by seven dwarf miners who make her part of their household."
186,Dangerous Liaisons,(1988),18+,119 min,"Drama, Romance",7.6,"
A scheming widow and her manipulative ex-lover make a bet regarding the corruption of a recently married woman."
187,God's Own Country,(2017),---,104 min,"Drama, Romance",7.6,"
Spring. Yorkshire. Young farmer Johnny Saxby numbs his daily frustrations with binge drinking and casual sex, until the arrival of a Romanian migrant worker for lambing season ignites an intense relationship that sets Johnny on a new path."
188,Sabrina,(1954),---,113 min,"Comedy, Drama, Romance",7.6,"
A playboy becomes interested in the daughter of his family's chauffeur, but it's his more serious brother who would be the better man for her."
189,The Bridges of Madison County,(1995),PG-13,135 min,"Drama, Romance",7.6,"
Photographer Robert Kincaid wanders into the life of housewife Francesca Johnson for four days in the 1960s."
190,50/50,(2011),13+,100 min,"Comedy, Drama, Romance",7.6,"
Inspired by a true story, a comedy centered on a 27-year-old guy who learns of his cancer diagnosis and his subsequent struggle to beat the disease."
191,From Here to Eternity,(1953),---,118 min,"Drama, Romance, War",7.6,"
At a U.S. Army base in 1941 Hawaii, a private is cruelly punished for not boxing on his unit's team, while his commanding officer's wife and top aide begin a tentative affair."
192,Victoria,(II) (2015),15+,138 min,"Crime, Drama, Romance",7.6,"
A young Spanish woman who has recently moved to Berlin finds her flirtation with a local guy turn potentially deadly as their night out with his friends reveals a dangerous secret."
193,Un long dimanche de fiançailles,(2004),R,133 min,"Drama, Mystery, Romance",7.6,"
Tells the story of a young woman's relentless search for her fiancé, who has disappeared from the trenches of the Somme during World War One."
194,Trois couleurs: Blanc,(1994),15+,92 min,"Comedy, Drama, Romance",7.6,"
After his wife divorces him, a Polish immigrant plots to get even with her."
195,Weekend,(II) (2011),---,97 min,"Drama, Romance",7.6,"
After a drunken house party with his straight mates, Russell heads out to a gay club. Just before closing time he picks up Glen but what's expected to be just a one-night stand becomes something else, something special."
196,La Vie En Rose,(2007),PG-13,140 min,"Biography, Drama, Music",7.6,"
Biopic of the iconic French singer Édith Piaf. Raised by her grandmother in a brothel, she was discovered while singing on a street corner at the age of 19. Despite her success, Piaf's life was filled with tragedy."
197,Gilda,(1946),---,110 min,"Drama, Film-Noir, Romance",7.6,"
A small-time gambler hired to work in a Buenos Aires casino discovers his employer's new wife is his former lover."
198,Shine,(1996),PG-13,105 min,"Biography, Drama, Music",7.6,"
Pianist David Helfgott, driven by his father and teachers, has a breakdown. Years later he returns to the piano, to popular if not critical acclaim."
199,Omohide poro poro,(1991),PG,119 min,"Animation, Drama, Romance",7.6,"
A twenty-seven-year-old office worker travels to the countryside while reminiscing about her childhood in Tokyo."
200,Vampire Hunter D: Bloodlust,(2000),R,103 min,"Animation, Action, Drama",7.6,"
A legendary dhampir competes with a motley family of bounty hunters to return a young woman, who has been seemingly abducted by a vampire, to her family."
201,Le violon rouge,(1998),R,130 min,"Drama, Music, Mystery",7.6,"
A red-colored violin inspires passion, making its way through three centuries over several owners and countries, eventually ending up at an auction where it may find a new owner."
202,Hævnen,(2010),R,118 min,"Drama, Romance",7.6,"
The lives of two Danish families cross each other, and an extraordinary but risky friendship comes into bud. But loneliness, frailty and sorrow lie in wait."
203,Baazigar,(1993),---,175 min,"Crime, Drama, Musical",7.6,"
A young man with a vendetta against a business tycoon seduces the man's younger daughter, but she begins to suspect her new lover's connection with her elder sister and his ulterior motive."
204,Highway,(I) (2014),---,133 min,"Crime, Drama, Romance",7.6,"
Right before her wedding, a young woman finds herself abducted and held for ransom. As the initial days pass, she begins to develop a strange bond with her kidnapper."
205,"Play It Again, Sam",(1972),---,85 min,"Comedy, Romance",7.6,"
A neurotic film critic obsessed with the movie Casablanca (1942) attempts to get over his wife leaving him by dating again with the help of a married couple and his illusory idol, Humphrey Bogart."
206,Kontroll,(2003),R,111 min,"Comedy, Crime, Drama",7.6,"
A tale about a strange young man, Bulcsú, the fellow inspectors on his team, all without exception likable characters, a rival ticket inspection team and racing along the tracks - and a tale about love."
207,The Magnificent Ambersons,(1942),---,88 min,"Drama, Romance",7.6,"
The spoiled young heir to the decaying Amberson fortune comes between his widowed mother and the man she has always loved."
208,Raanjhanaa,(2013),---,140 min,"Drama, Romance",7.6,"
Kundan, the son of a Hindu pundit, discovers that his childhood sweetheart Zoya loves city-bred Akram and wants to marry him. However, he persistently seeks to win her heart."
209,Wake Up Sid,(2009),---,138 min,"Comedy, Drama, Romance",7.6,"
The story of a lazy Mumbai college student who does absolutely nothing, with a turn of events will Sid realize his potential in this world and become a success in the fast-paced life of Mumbai."
210,Tanu Weds Manu Returns,(2015),---,128 min,"Comedy, Drama, Romance",7.6,"
Tanu and Manu's marriage collapses. What happens when Manu meets Tanu's lookalike Kusum - and when Tanu returns?"
211,Scott Pilgrim vs. the World,(2010),13+,112 min,"Action, Comedy, Fantasy",7.5,"
In a magically realistic version of Toronto, a young man must defeat his new girlfriend's seven evil exes one by one in order to win her heart."
212,Les Misérables,(2012),13+,158 min,"Drama, Musical, Romance",7.5,"
In 19th-century France, Jean Valjean, who for decades has been hunted by the ruthless policeman Javert after breaking parole, agrees to care for a factory worker's daughter. The decision changes their lives forever."
213,Tenki no ko,(2019),PG-13,112 min,"Animation, Drama, Fantasy",7.5,"
A high-school boy who has run away to Tokyo befriends a girl who appears to be able to manipulate the weather."
214,Leaving Las Vegas,(1995),18+,111 min,"Drama, Romance",7.5,"
Ben Sanderson, a Hollywood screenwriter who lost everything because of his alcoholism, arrives in Las Vegas to drink himself to death. There, he meets and forms an uneasy friendship and non-interference pact with prostitute Sera."
215,Little Children,(2006),13+,137 min,"Drama, Romance",7.5,"
The lives of two lovelorn spouses from separate marriages, a registered sex offender, and a disgraced ex-police officer intersect as they struggle to resist their vulnerabilities and temptations in suburban Massachusetts."
216,Lolita,(1962),---,153 min,"Crime, Drama, Romance",7.5,"
A middle-aged college professor becomes infatuated with a fourteen-year-old girl."
217,Legends of the Fall,(1994),13A,133 min,"Drama, Romance, War",7.5,"
In the early 1900s, three brothers and their father living in the remote wilderness of Montana are affected by betrayal, history, love, nature, and war."
218,The Art of Racing in the Rain,(2019),18+,109 min,"Comedy, Drama, Romance",7.5,"
Through his bond with his owner, aspiring Formula One race car driver Denny, golden retriever Enzo learns that the techniques needed on the racetrack can also be used to successfully navigate the journey of life."
219,The Piano,(1993),16+,121 min,"Drama, Music, Romance",7.5,"
In the mid-19th century a mute woman is sent to New Zealand along with her young daughter and prized piano for an arranged marriage to a farmer, but is soon lusted after by a farm worker."
220,"Se, jie",(2007),NC-17,157 min,"Drama, History, Romance",7.5,"
During World War II era, a young woman, Wang Jiazhi, gets swept up in a dangerous game of emotional intrigue with a powerful political figure, Mr. Yee."
221,Brooklyn,(2015),7+,117 min,"Drama, Romance",7.5,"
An Irish immigrant lands in 1950s Brooklyn, where she quickly falls into a romance with a local. When her past catches up with her, however, she must choose between two countries and the lives that exist within."
222,El Dorado,(1966),---,126 min,"Drama, Romance, Western",7.5,"
Cole Thornton, a gunfighter for hire, joins forces with an old friend, Sheriff J.P. Hara. Together with an old Indian fighter and a gambler, they help a rancher and his family fight a rival rancher that is trying to steal their water."
223,Sideways,(2004),G,127 min,"Comedy, Drama, Romance",7.5,"
Two men reaching middle age with not much to show but disappointment embark on a week-long road trip through California's wine country, just as one is about to take a trip down the aisle."
224,Boys Don't Cry,(1999),18+,118 min,"Biography, Crime, Drama",7.5,"
A young man named Brandon Teena navigates love, life, and being transgender in rural Nebraska."
225,The Illusionist,(2006),13+,110 min,"Drama, Fantasy, Mystery",7.5,"
In turn-of-the-century Vienna, a magician uses his abilities to secure the love of a woman far above his social standing."
226,Robin Hood,(1973),---,83 min,"Animation, Adventure, Comedy",7.5,"
The story of the legendary British outlaw portrayed with the characters as anthropomorphic animals."
227,Sophie's Choice,(1982),---,150 min,"Drama, Romance",7.5,"
Sophie is the survivor of Nazi concentration camps, who has found a reason to live with Nathan, a sparkling if unsteady American Jew obsessed with the Holocaust."
228,Waves,(I) (2019),18+,135 min,"Drama, Romance, Sport",7.5,"
Traces the journey of a suburban family - led by a well-intentioned but domineering father - as they navigate love, forgiveness, and coming together in the aftermath of a loss."
229,Byôsoku 5 senchimêtoru,(2007),---,63 min,"Animation, Drama, Family",7.5,"
Told in three interconnected segments, we follow a young man named Takaki through his life as cruel winters, cold technology, and finally, adult obligations and responsibility converge to test the delicate petals of love."
230,"Love, Simon",(2018),15+,110 min,"Comedy, Drama, Romance",7.5,"
Simon Spier keeps a huge secret from his family, his friends and all of his classmates: he's gay. When that secret is threatened, Simon must face everyone and come to terms with his identity."
